faculty_name,faculty_email,publication_type,title,journal,year,doi,url,file_created
Jessica Hopkins,hopkij1@mcmaster.ca,journal_articles,Barriers and opportunities faced by public health practitioners in using public health guidance on COVID-19: a knowledge translation exercise for the eCOVID-19 RecMap,Journal of Clinical Epidemiology,2024,10.1016/j.jclinepi.2024.111410,https://experts.mcmaster.ca/display/publication3437487,2025-07-27T15:07:54.160174
Jessica Hopkins,hopkij1@mcmaster.ca,journal_articles,Challenges of determining the relative contribution of determinants of health on population health: a Canadian perspective,Perspectives in Public Health,2024,10.1177/17579139241236655,https://experts.mcmaster.ca/display/publication3431709,2025-07-27T15:07:54.160182
Jessica Hopkins,hopkij1@mcmaster.ca,journal_articles,Targeted amplification-based whole genome sequencing ofMonkeypox virusin clinical specimens,Microbiology spectrum,2024,10.1128/spectrum.02979-23,https://experts.mcmaster.ca/display/publication3321695,2025-07-27T15:07:54.160184
Jessica Hopkins,hopkij1@mcmaster.ca,journal_articles,Burnout among public health workers in Canada: a cross-sectional study,BMC International Health and Human Rights,2024,10.1186/s12889-023-17572-w,https://experts.mcmaster.ca/display/publication3385510,2025-07-27T15:07:54.160186
Jessica Hopkins,hopkij1@mcmaster.ca,journal_articles,Early (years) reactions: comparative analysis of early childhood policies and programs during the first wave of the COVID-19 pandemic,BMC International Health and Human Rights,2022,10.1186/s12889-022-13344-0,https://experts.mcmaster.ca/display/publication2378973,2025-07-27T15:07:54.160187
Jessica Hopkins,hopkij1@mcmaster.ca,journal_articles,Effect of Wearing a Face Mask on Hand-to-Face Contact by Children in a Simulated School Environment,JAMA Pediatrics,2022,10.1001/jamapediatrics.2022.3833,https://experts.mcmaster.ca/display/publication2472483,2025-07-27T15:07:54.160189
Jessica Hopkins,hopkij1@mcmaster.ca,journal_articles,Impact of coronavirus disease 2019 (COVID-19) pre-test probability on positive predictive value of high cycle threshold severe acute respiratory coronavirus virus 2 (SARS-CoV-2) real-time reverse transcription polymerase chain reaction (RT-PCR) test results,Infection Control and Hospital Epidemiology,2022,10.1017/ice.2021.369,https://experts.mcmaster.ca/display/publication2106033,2025-07-27T15:07:54.160190
Jessica Hopkins,hopkij1@mcmaster.ca,journal_articles,"Comparison of longitudinal trends in self-reported symptoms and COVID-19 case activity in Ontario, Canada",PLoS ONE,2022,10.1371/journal.pone.0262447,https://experts.mcmaster.ca/display/publication2162566,2025-07-27T15:07:54.160192
Jessica Hopkins,hopkij1@mcmaster.ca,journal_articles,"S-Gene Target Failure as a Marker of Variant B.1.1.7 Among SARS-CoV-2 Isolates in the Greater Toronto Area, December 2020 to March 2021",Journal of the American Medical Association (JAMA),2021,10.1001/jama.2021.5607,https://experts.mcmaster.ca/display/publication1985392,2025-07-27T15:07:54.160193
Jessica Hopkins,hopkij1@mcmaster.ca,journal_articles,"The effect of seasonal respiratory virus transmission on syndromic surveillance for COVID-19 in Ontario, Canada",The Lancet Infectious Diseases,2021,10.1016/s1473-3099(21)00151-1,https://experts.mcmaster.ca/display/publication1965154,2025-07-27T15:07:54.160195
Jessica Hopkins,hopkij1@mcmaster.ca,journal_articles,"Low prioritization of latent tuberculosis infection—Asystemic barrier to tuberculosis control:Aqualitative study inOntario,Canada",International Journal of Health Planning and Management,2019,10.1002/hpm.2670,https://experts.mcmaster.ca/display/publication1607154,2025-07-27T15:07:54.160197
Jessica Hopkins,hopkij1@mcmaster.ca,journal_articles,Evaluation of the ability of standardized supports to improve public health response to syndromic surveillance for respiratory diseases in Canada,BMC International Health and Human Rights,2017,10.1186/s12889-017-4073-6,https://experts.mcmaster.ca/display/publication608847,2025-07-27T15:07:54.160198
Jessica Hopkins,hopkij1@mcmaster.ca,journal_articles,Evaluation of the ability of standardized supports to improve public health response to syndromic surveillance for respiratory diseases in Canada,BMC Public Health,2017,10.1186/s12889-017-4073-6,https://experts.mcmaster.ca/display/publication1197738,2025-07-27T15:07:54.160200
Jessica Hopkins,hopkij1@mcmaster.ca,journal_articles,"Systematic reviews and meta-analyses of benefits and harms of cryotherapy, LEEP, and cold knife conization to treat cervical intraepithelial neoplasia",International Journal of Gynecology and Obstetrics,2016,10.1016/j.ijgo.2015.07.026,https://experts.mcmaster.ca/display/publication608885,2025-07-27T15:07:54.160201
Jessica Hopkins,hopkij1@mcmaster.ca,journal_articles,"Systematic reviews and meta-analyses of the accuracy of HPV tests, visual inspection with acetic acid, cytology, and colposcopy",International Journal of Gynecology and Obstetrics,2016,10.1016/j.ijgo.2015.07.024,https://experts.mcmaster.ca/display/publication608884,2025-07-27T15:07:54.160203
Jessica Hopkins,hopkij1@mcmaster.ca,journal_articles,A comparative analysis of early child health and development services and outcomes in countries with different redistributive policies,BMC International Health and Human Rights,2013,10.1186/1471-2458-13-1049,https://experts.mcmaster.ca/display/publication608927,2025-07-27T15:07:54.160204
Jessica Hopkins,hopkij1@mcmaster.ca,journal_articles,"Effect of Aerobic Exercise on Cognition, Academic Achievement, and Psychosocial Function in Children: A Systematic Review of Randomized Control Trials",Preventing Chronic Disease,2013,10.5888/pcd10.130010,https://experts.mcmaster.ca/display/publication608931,2025-07-27T15:07:54.160206
Jessica Hopkins,hopkij1@mcmaster.ca,journal_articles,Antivirals for influenza: a summary of a systematic review and meta-analysis of observational studies,Influenza and other Respiratory Viruses,2013,10.1111/irv.12085,https://experts.mcmaster.ca/display/publication970139,2025-07-27T15:07:54.160207
Jessica Hopkins,hopkij1@mcmaster.ca,journal_articles,Single nucleotide polymorphisms in the matrix metalloproteinase gene family and the frequency and duration of gastroesophageal reflux disease influence the risk of esophageal adenocarcinoma,International Journal of Cancer,2012,10.1002/ijc.27541,https://experts.mcmaster.ca/display/publication608964,2025-07-27T15:07:54.160209
Jessica Hopkins,hopkij1@mcmaster.ca,journal_articles,Antivirals for treatment of influenza: a systematic review and meta-analysis of observational studies,ACP journal club,2012,10.7326/0003-4819-156-7-201204030-00411,https://experts.mcmaster.ca/display/publication970148,2025-07-27T15:07:54.160210
Jessica Hopkins,hopkij1@mcmaster.ca,journal_articles,Quality indicators for the prevention of cardiovascular disease in primary care.,Canadian Family Physician,2010,,https://experts.mcmaster.ca/display/publication552821,2025-07-27T15:07:54.160212
Jessica Hopkins,hopkij1@mcmaster.ca,journal_articles,Vascular Endothelial Growth Factor Polymorphisms and Esophageal Cancer Prognosis,Clinical Cancer Research,2009,10.1158/1078-0432.ccr-09-0192,https://experts.mcmaster.ca/display/publication608994,2025-07-27T15:07:54.160213
Jessica Hopkins,hopkij1@mcmaster.ca,journal_articles,"p53 Arg72ProandMDM2 T309GPolymorphisms, Histology, and Esophageal Cancer Prognosis",Clinical Cancer Research,2009,10.1158/1078-0432.ccr-08-3120,https://experts.mcmaster.ca/display/publication2186061,2025-07-27T15:07:54.160215
Jessica Hopkins,hopkij1@mcmaster.ca,journal_articles,"Matrix metalloproteinase 1, 3 and 12 polymorphisms and esophageal adenocarcinoma risk and prognosis",Carcinogenesis,2009,10.1093/carcin/bgp065,https://experts.mcmaster.ca/display/publication2186062,2025-07-27T15:07:54.160216
Jessica Hopkins,hopkij1@mcmaster.ca,journal_articles,Genetic Polymorphisms and Head and Neck Cancer Outcomes: A Review,"Cancer Epidemiology, Biomarkers and Prevention",2008,10.1158/1055-9965.epi-07-2714,https://experts.mcmaster.ca/display/publication609006,2025-07-27T15:07:54.160218
Jessica Hopkins,hopkij1@mcmaster.ca,journal_articles,Advertisement,CANADIAN MEDICAL ASSOCIATION JOURNAL,2007,10.1503/cmaj.1070154,https://experts.mcmaster.ca/display/publication1197639,2025-07-27T15:07:54.160219
