faculty_name,faculty_email,publication_type,title,journal,year,doi,url,file_created
Lawrence Grierson,griersle@mcmaster.ca,journal_articles,"Experiences of Moral Distress in Canadian Intensive Care Unit Professionals During and After the COVID-19 Pandemic: A Qualitative Exploratory Multiple Case Study in Ontario and Alberta, Canada.",Journal of Intensive Care Medicine,2025,10.1177/08850666251329828,https://experts.mcmaster.ca/display/publication3570972,2025-07-27T15:06:41.094483
Lawrence Grierson,griersle@mcmaster.ca,journal_articles,A qualitative study of the grassroots development of interprofessional primary care teams.,British Journal of General Practice,2025,10.3399/BJGP.2024.0756,https://experts.mcmaster.ca/display/publication3592815,2025-07-27T15:06:41.094506
Lawrence Grierson,griersle@mcmaster.ca,journal_articles,A change of mind: Error motivation is shaped by error perceptions in different learning environments.,Medical Teacher,2025,10.1080/0142159X.2024.2412783,https://experts.mcmaster.ca/display/publication3480191,2025-07-27T15:06:41.094510
Lawrence Grierson,griersle@mcmaster.ca,journal_articles,"Predictors of Success in a Graduate, Entry-Level Professional Program: From Admissions to Graduation",Journal of Physical Therapy Education,2025,10.1097/jte.0000000000000364,https://experts.mcmaster.ca/display/publication3458745,2025-07-27T15:06:41.094513
Lawrence Grierson,griersle@mcmaster.ca,journal_articles,Toward Monitoring and Addressing the Commercial Determinants of Health: Where Can We Go From Here?,Milbank Quarterly,2025,10.1111/1468-0009.70012,https://experts.mcmaster.ca/display/publication3587647,2025-07-27T15:06:41.094516
Lawrence Grierson,griersle@mcmaster.ca,journal_articles,Continuity of care during long-term care transitions: a scoping review of the Canadian literature.,BMC Health Services Research,2025,10.1186/s12913-025-12558-3,https://experts.mcmaster.ca/display/publication3576324,2025-07-27T15:06:41.094520
Lawrence Grierson,griersle@mcmaster.ca,journal_articles,Expert learning in musculoskeletal ultrasound - an international observational study.,Ultraschall in der Medizin,2025,10.1055/a-2532-6860,https://experts.mcmaster.ca/display/publication3574306,2025-07-27T15:06:41.094523
Lawrence Grierson,griersle@mcmaster.ca,journal_articles,Evidence of Differential Attainment in Canadian Medical School Admissions: A Scoping Review.,Academic Medicine,2025,10.1097/ACM.0000000000005836,https://experts.mcmaster.ca/display/publication3464359,2025-07-27T15:06:41.094527
Lawrence Grierson,griersle@mcmaster.ca,journal_articles,Advancing healthcare practice and education via data sharing: demonstrating the utility of open data by training an artificial intelligence model to assess cardiopulmonary resuscitation skills.,Advances in Health Sciences Education,2025,10.1007/s10459-024-10369-5,https://experts.mcmaster.ca/display/publication3468403,2025-07-27T15:06:41.094530
Lawrence Grierson,griersle@mcmaster.ca,journal_articles,Can all roads lead to competency? School levels effects in Licensing examinations scores.,Advances in Health Sciences Education,2025,10.1007/s10459-024-10398-0,https://experts.mcmaster.ca/display/publication3502301,2025-07-27T15:06:41.094534
Lawrence Grierson,griersle@mcmaster.ca,journal_articles,Correction to: Can all roads lead to competency? School levels effects in licensing examinations scores.,Advances in Health Sciences Education,2025,10.1007/s10459-025-10419-6,https://experts.mcmaster.ca/display/publication3554594,2025-07-27T15:06:41.094538
Lawrence Grierson,griersle@mcmaster.ca,journal_articles,Data science in health professions education: promises and challenges.,Advances in Health Sciences Education,2025,10.1007/s10459-025-10415-w,https://experts.mcmaster.ca/display/publication3538584,2025-07-27T15:06:41.094541
Lawrence Grierson,griersle@mcmaster.ca,journal_articles,From admissions to licensure: education data associations from a multi-centre undergraduate medical education collaboration,Advances in Health Sciences Education,2024,10.1007/s10459-024-10326-2,https://experts.mcmaster.ca/display/publication3436694,2025-07-27T15:06:41.094545
Lawrence Grierson,griersle@mcmaster.ca,journal_articles,A survey of medical school aspirant perceptions of an unexpected lottery‐facilitated admissions adaptation,Journal of Evaluation in Clinical Practice,2024,10.1111/jep.13994,https://experts.mcmaster.ca/display/publication3414543,2025-07-27T15:06:41.094548
Lawrence Grierson,griersle@mcmaster.ca,journal_articles,Leveraging Education Science for AI-Clinician Collaboration in the Patient Care Ecosystem,Ann Surg Open,2024,10.1097/as9.0000000000000442,https://experts.mcmaster.ca/display/publication3446001,2025-07-27T15:06:41.094552
Lawrence Grierson,griersle@mcmaster.ca,journal_articles,Associations between education policies and the geographic disposition of family physicians: a retrospective observational study of McMaster University education data,Advances in Health Sciences Education,2024,10.1007/s10459-023-10273-4,https://experts.mcmaster.ca/display/publication3283327,2025-07-27T15:06:41.094555
Lawrence Grierson,griersle@mcmaster.ca,journal_articles,Data sharing and big data in health professions education: Ottawa consensus statement and recommendations for scholarship,Medical Teacher,2024,10.1080/0142159x.2023.2298762,https://experts.mcmaster.ca/display/publication3400755,2025-07-27T15:06:41.094558
Lawrence Grierson,griersle@mcmaster.ca,journal_articles,Understanding the influence of medical education on physician geographic disposition: A qualitative study of family physician perspectives in Canada,Journal of Evaluation in Clinical Practice,2023,10.1111/jep.13936,https://experts.mcmaster.ca/display/publication3307107,2025-07-27T15:06:41.095441
Lawrence Grierson,griersle@mcmaster.ca,journal_articles,A brief report of aspiring medical student perceptions and behaviours concerning research experiences for selection into Canadian medical schools,Canadian Medical Education Journal,2023,10.36834/cmej.76255,https://experts.mcmaster.ca/display/publication3285649,2025-07-27T15:06:41.095460
Lawrence Grierson,griersle@mcmaster.ca,journal_articles,"Inter-institutional data-driven education research: consensus values, principles, and recommendations to guide the ethical sharing of administrative education data in the Canadian medical education research context",Canadian Medical Education Journal,2023,10.36834/cmej.75874,https://experts.mcmaster.ca/display/publication3320040,2025-07-27T15:06:41.095464
Lawrence Grierson,griersle@mcmaster.ca,journal_articles,The Certificate of Added Competence credentialling program in family medicine: a descriptive survey of the family physician perspective of enhanced skill practices in Canada,Canadian Medical Education Journal,2023,10.36834/cmej.77114,https://experts.mcmaster.ca/display/publication3303162,2025-07-27T15:06:41.095467
Lawrence Grierson,griersle@mcmaster.ca,journal_articles,Training in Team-Based Practices: A Descriptive Analysis of Family Medicine Postgraduate Site Distribution across Canada,Healthcare Policy,2023,10.12927/hcpol.2023.27233,https://experts.mcmaster.ca/display/publication3324280,2025-07-27T15:06:41.095471
Lawrence Grierson,griersle@mcmaster.ca,journal_articles,How medical learners and educators decide what counts as mistreatment: A qualitative study,Medical Education,2023,10.1111/medu.15065,https://experts.mcmaster.ca/display/publication2864661,2025-07-27T15:06:41.095474
Lawrence Grierson,griersle@mcmaster.ca,journal_articles,Comment on: The AI and I: A Collaboration on Competence,Ann Surg Open,2023,10.1097/as9.0000000000000271,https://experts.mcmaster.ca/display/publication3285648,2025-07-27T15:06:41.095478
Lawrence Grierson,griersle@mcmaster.ca,journal_articles,Family Physicians with Certificates of Added Competence in Palliative Care Contribute to Comprehensive Care in Their Communities: A Qualitative Descriptive Study,Palliative Medicine Reports,2023,10.1089/pmr.2022.0057,https://experts.mcmaster.ca/display/publication2893676,2025-07-27T15:06:41.095558
Lawrence Grierson,griersle@mcmaster.ca,journal_articles,Empathy for the health professional in online asynchronous graduate education: an initial design thinking approach to program improvement,Discover Education,2022,10.1007/s44217-022-00009-8,https://experts.mcmaster.ca/display/publication2893317,2025-07-27T15:06:41.095566
Lawrence Grierson,griersle@mcmaster.ca,journal_articles,Re-examining the integration of routine and adaptive expertise: there is no such thing as routine from a motor control perspective,Advances in Health Sciences Education,2022,10.1007/s10459-022-10163-1,https://experts.mcmaster.ca/display/publication2526210,2025-07-27T15:06:41.095569
Lawrence Grierson,griersle@mcmaster.ca,journal_articles,Research experiences for Canadian aspiring physicians: a descriptive analysis of medical school admission policies concerning research involvement in Canada,BMC Medical Education,2022,10.1186/s12909-022-03207-y,https://experts.mcmaster.ca/display/publication2174609,2025-07-27T15:06:41.095572
Lawrence Grierson,griersle@mcmaster.ca,journal_articles,The impact of care of the elderly certificates of added competence on family physician practice: results from a pan-Canadian multiple case study,BMC Geriatrics,2022,10.1186/s12877-022-03523-4,https://experts.mcmaster.ca/display/publication2498939,2025-07-27T15:06:41.095576
Lawrence Grierson,griersle@mcmaster.ca,journal_articles,A Win–Win for Sport and Exercise Medicine and Primary Care: A Qualitative Case Study of the Added Competence Model in Canada,Sports Medicine,2022,10.1007/s40279-022-01663-6,https://experts.mcmaster.ca/display/publication2175697,2025-07-27T15:06:41.095579
Lawrence Grierson,griersle@mcmaster.ca,journal_articles,The CFPC certificate of added competence (CAC) in emergency medicine: reflections from current research on the CAC program,Canadian Journal of Emergency Medicine,2022,10.1007/s43678-022-00302-3,https://experts.mcmaster.ca/display/publication2183994,2025-07-27T15:06:41.095582
Lawrence Grierson,griersle@mcmaster.ca,journal_articles,The concept of errors in medical education: a scoping review,Advances in Health Sciences Education,2022,10.1007/s10459-022-10091-0,https://experts.mcmaster.ca/display/publication2173034,2025-07-27T15:06:41.095585
Lawrence Grierson,griersle@mcmaster.ca,journal_articles,Monitoring the integrity and usability of policy evaluation tools within an evolving sociocultural context: A demonstration of reflexivity using the CFPC Family Medicine Longitudinal Survey,Journal of Evaluation in Clinical Practice,2022,10.1111/jep.13646,https://experts.mcmaster.ca/display/publication2155121,2025-07-27T15:06:41.095589
Lawrence Grierson,griersle@mcmaster.ca,journal_articles,Motivations for Pursuing Enhanced Skill Credentials in Family Medicine:   A Study of the Certificates of Added Competence in Canada,Family Medicine,2022,10.22454/fammed.2022.213612,https://experts.mcmaster.ca/display/publication2336513,2025-07-27T15:06:41.095592
Lawrence Grierson,griersle@mcmaster.ca,journal_articles,Associations between admissions factors and the need for remediation,Advances in Health Sciences Education,2022,10.1007/s10459-022-10097-8,https://experts.mcmaster.ca/display/publication2168752,2025-07-27T15:06:41.095596
Lawrence Grierson,griersle@mcmaster.ca,journal_articles,Mastery versus invention learning: impacts on future learning of simulated procedural skills,Advances in Health Sciences Education,2022,10.1007/s10459-022-10094-x,https://experts.mcmaster.ca/display/publication2182113,2025-07-27T15:06:41.095599
Lawrence Grierson,griersle@mcmaster.ca,journal_articles,Medical education interventions influencing physician distribution into underserved communities: a scoping review,Human Resources for Health,2022,10.1186/s12960-022-00726-z,https://experts.mcmaster.ca/display/publication2182893,2025-07-27T15:06:41.095602
Lawrence Grierson,griersle@mcmaster.ca,journal_articles,Two sides of the same coin: Quality improvement and program evaluation in health professions education,Journal of Evaluation in Clinical Practice,2022,10.1111/jep.13598,https://experts.mcmaster.ca/display/publication2026270,2025-07-27T15:06:41.095605
Lawrence Grierson,griersle@mcmaster.ca,journal_articles,Understanding moral empathy: A verbatim‐theatre supported phenomenological exploration of the empathy imperative,Medical Education,2022,10.1111/medu.14676,https://experts.mcmaster.ca/display/publication2136673,2025-07-27T15:06:41.095609
Lawrence Grierson,griersle@mcmaster.ca,journal_articles,Thinking about social power and hierarchy in medical education,Medical Education,2022,10.1111/medu.14659,https://experts.mcmaster.ca/display/publication2125088,2025-07-27T15:06:41.095612
Lawrence Grierson,griersle@mcmaster.ca,journal_articles,Contribution of Retinal Motion to the Impulse Control of Target-Directed Aiming,American Journal of Psychology,2021,10.5406/amerjpsyc.134.3.0285,https://experts.mcmaster.ca/display/publication2133238,2025-07-27T15:06:41.095615
Lawrence Grierson,griersle@mcmaster.ca,journal_articles,Impacts of the Certificates of Added Competence credentialling program: a qualitative case study of enhanced-skill family medicine practice across Canada,CMAJ open,2021,10.9778/cmajo.20200278,https://experts.mcmaster.ca/display/publication2158552,2025-07-27T15:06:41.095619
Lawrence Grierson,griersle@mcmaster.ca,journal_articles,Spiralling Pre-clerkship Concepts into the Clinical Phase: Augmenting Knowledge Transfer Using Innovative Technology-Enhanced Curriculum Activities,Medical Science Educator,2021,10.1007/s40670-021-01348-1,https://experts.mcmaster.ca/display/publication1986740,2025-07-27T15:06:41.095622
Lawrence Grierson,griersle@mcmaster.ca,journal_articles,The rich potential for education research in family medicine and general practice,Advances in Health Sciences Education,2021,10.1007/s10459-020-09994-7,https://experts.mcmaster.ca/display/publication1927634,2025-07-27T15:06:41.095797
Lawrence Grierson,griersle@mcmaster.ca,journal_articles,The computerized objective assessment of surgical skills: Considerations for counting the number of movements,Journal of Evaluation in Clinical Practice,2021,10.1111/jep.13500,https://experts.mcmaster.ca/display/publication1936302,2025-07-27T15:06:41.095804
Lawrence Grierson,griersle@mcmaster.ca,journal_articles,Clinician responses to legal requests for hastened death: a systematic review and meta-synthesis of qualitative research,BMJ Supportive and Palliative Care,2021,10.1136/bmjspcare-2019-002018,https://experts.mcmaster.ca/display/publication1916643,2025-07-27T15:06:41.095808
Lawrence Grierson,griersle@mcmaster.ca,journal_articles,The Allocation of Medical School Spaces in Canada by Province and Territory: The Need for Evidence-Based Health Workforce Policy,Healthcare Policy,2021,10.12927/hcpol.2021.26429,https://experts.mcmaster.ca/display/publication1963538,2025-07-27T15:06:41.095811
Lawrence Grierson,griersle@mcmaster.ca,journal_articles,Professional expectations of perfection stymy remediation and growth,Medical Education,2020,10.1111/medu.14367,https://experts.mcmaster.ca/display/publication1925046,2025-07-27T15:06:41.095815
Lawrence Grierson,griersle@mcmaster.ca,journal_articles,The multiple process model of goal-directed aiming/reaching: insights on limb control from various special populations,Experimental Brain Research,2020,10.1007/s00221-020-05952-2,https://experts.mcmaster.ca/display/publication1936301,2025-07-27T15:06:41.095818
Lawrence Grierson,griersle@mcmaster.ca,journal_articles,Early Impulse Control: Treatment of Potential Errors within Pre-Programming and Control,Journal of Motor Behavior,2020,10.1080/00222895.2019.1683506,https://experts.mcmaster.ca/display/publication1676956,2025-07-27T15:06:41.095822
Lawrence Grierson,griersle@mcmaster.ca,journal_articles,The reliability characteristics of the REFLECT rubric for assessing reflective capacity through expressive writing assignments: A&nbsp;replication study,Tijdschrift voor Medisch Onderwijs,2020,10.1007/s40037-020-00611-2,https://experts.mcmaster.ca/display/publication1922778,2025-07-27T15:06:41.095826
Lawrence Grierson,griersle@mcmaster.ca,journal_articles,The relationship between regional medical campus enrollment and rates of matching to family medicine residency,Canadian Medical Education Journal,2020,10.36834/cmej.69328,https://experts.mcmaster.ca/display/publication1922747,2025-07-27T15:06:41.095829
Lawrence Grierson,griersle@mcmaster.ca,journal_articles,Social power facilitates and constrains motivation in the clinical learning environment,Medical Education,2020,10.1111/medu.14046,https://experts.mcmaster.ca/display/publication1684856,2025-07-27T15:06:41.095831
Lawrence Grierson,griersle@mcmaster.ca,journal_articles,"A&nbsp;multiple-trainee, multiple-level, multiple-competency (multi-TLC) simulation-based approach to training obstetrical emergencies",Tijdschrift voor Medisch Onderwijs,2019,10.1007/s40037-019-00534-7,https://experts.mcmaster.ca/display/publication1670335,2025-07-27T15:06:41.096911
Lawrence Grierson,griersle@mcmaster.ca,journal_articles,Medical student strategies for actively negotiating hierarchy in the clinical environment,Medical Education,2019,10.1111/medu.13945,https://experts.mcmaster.ca/display/publication1663105,2025-07-27T15:06:41.096928
Lawrence Grierson,griersle@mcmaster.ca,journal_articles,When I say … merit,Medical Education,2019,10.1111/medu.13894,https://experts.mcmaster.ca/display/publication1640970,2025-07-27T15:06:41.096933
Lawrence Grierson,griersle@mcmaster.ca,journal_articles,Key differences between severity of disciplinary issues and medical student insights,Medical Education,2019,10.1111/medu.13910,https://experts.mcmaster.ca/display/publication1642143,2025-07-27T15:06:41.096937
Lawrence Grierson,griersle@mcmaster.ca,journal_articles,Lines in the sand: pre-interview rank and probability of receiving admission to medical school,Canadian Medical Education Journal,2019,10.36834/cmej.61275,https://experts.mcmaster.ca/display/publication1658921,2025-07-27T15:06:41.096984
Lawrence Grierson,griersle@mcmaster.ca,journal_articles,"Development and psychometric evaluation of an instrument to measure knowledge, skills, and attitudes towards quality improvement in health professions education: The Beliefs, Attitudes, Skills, and Confidence in Quality Improvement (BASiC-QI) Scale",Tijdschrift voor Medisch Onderwijs,2019,10.1007/s40037-019-0511-8,https://experts.mcmaster.ca/display/publication1642003,2025-07-27T15:06:41.096993
Lawrence Grierson,griersle@mcmaster.ca,journal_articles,"Family medicine residents' knowledge of, attitudes toward, and clinical practices related to environmental health: Multi-program survey.",Canadian Family Physician,2019,,https://experts.mcmaster.ca/display/publication1645299,2025-07-27T15:06:41.096997
Lawrence Grierson,griersle@mcmaster.ca,journal_articles,Can first-year medical students acquire quality improvement knowledge prior to substantial clinical exposure? A mixed-methods evaluation of a pre-clerkship curriculum that uses education as the context for learning,BMJ Quality and Safety,2018,10.1136/bmjqs-2017-007566,https://experts.mcmaster.ca/display/publication1513286,2025-07-27T15:06:41.097001
Lawrence Grierson,griersle@mcmaster.ca,journal_articles,A Call to Investigate the Relationship Between Education and Health Outcomes Using Big Data,Academic Medicine,2018,10.1097/acm.0000000000002217,https://experts.mcmaster.ca/display/publication1505256,2025-07-27T15:06:41.097105
Lawrence Grierson,griersle@mcmaster.ca,journal_articles,Using a Social Educational Network to Facilitate Peer-Feedback for a Virtual Simulation,ACM Computers in Entertainment,2018,10.1145/3180659,https://experts.mcmaster.ca/display/publication1729457,2025-07-27T15:06:41.097161
Lawrence Grierson,griersle@mcmaster.ca,journal_articles,How can systems engineering inform the methods of programme evaluation in health professions education?,Medical Education,2018,10.1111/medu.13460,https://experts.mcmaster.ca/display/publication1474718,2025-07-27T15:06:41.097175
Lawrence Grierson,griersle@mcmaster.ca,journal_articles,The Application of Observational Practice and Educational Networking in Simulation-Based and Distributed Medical Education Contexts,Simulation in Healthcare,2018,10.1097/sih.0000000000000268,https://experts.mcmaster.ca/display/publication1519531,2025-07-27T15:06:41.097179
Lawrence Grierson,griersle@mcmaster.ca,journal_articles,Enhancing technical skill learning through interleaved mixed-model observational practice,Advances in Health Sciences Education,2017,10.1007/s10459-017-9759-0,https://experts.mcmaster.ca/display/publication1519533,2025-07-27T15:06:41.097185
Lawrence Grierson,griersle@mcmaster.ca,journal_articles,Admission factors associated with international medical graduate certification success: a collaborative retrospective review of postgraduate medical education programs in Ontario,CMAJ open,2017,10.9778/cmajo.20170073,https://experts.mcmaster.ca/display/publication1482459,2025-07-27T15:06:41.097194
Lawrence Grierson,griersle@mcmaster.ca,journal_articles,Education as a context for early engagement in quality improvement,Medical Education,2017,10.1111/medu.13453,https://experts.mcmaster.ca/display/publication1455826,2025-07-27T15:06:41.097202
Lawrence Grierson,griersle@mcmaster.ca,journal_articles,The art of medicine: arts-based training in observation and mindfulness for fostering the empathic response in medical residents,Medical Humanities,2017,10.1136/medhum-2016-011180,https://experts.mcmaster.ca/display/publication800916,2025-07-27T15:06:41.097205
Lawrence Grierson,griersle@mcmaster.ca,journal_articles,The effect of modeled absolute timing variability and relative timing variability on observational learning,Acta Psychologica,2017,10.1016/j.actpsy.2017.03.013,https://experts.mcmaster.ca/display/publication1519530,2025-07-27T15:06:41.097209
Lawrence Grierson,griersle@mcmaster.ca,journal_articles,An examination of Eyal & Hurst’s (2008) framework for promoting retention in resource-poor settings through locally-relevant training: A case study for the University of Guyana Surgical Training Program,Canadian Medical Education Journal,2017,10.36834/cmej.36849,https://experts.mcmaster.ca/display/publication1472612,2025-07-27T15:06:41.097213
Lawrence Grierson,griersle@mcmaster.ca,journal_articles,The multiple process model of goal-directed reaching revisited,Neuroscience and Biobehavioral Reviews,2017,10.1016/j.neubiorev.2016.11.016,https://experts.mcmaster.ca/display/publication245370,2025-07-27T15:06:41.097217
Lawrence Grierson,griersle@mcmaster.ca,journal_articles,Corrigendum,Medical Education,2016,10.1111/medu.13213,https://experts.mcmaster.ca/display/publication311037,2025-07-27T15:06:41.097220
Lawrence Grierson,griersle@mcmaster.ca,journal_articles,The relationship between perceived preceptor power use and student empowerment during clerkship rotations: a study of hidden curriculum,Medical Education,2016,10.1111/medu.13065,https://experts.mcmaster.ca/display/publication173536,2025-07-27T15:06:41.097224
Lawrence Grierson,griersle@mcmaster.ca,journal_articles,OSCE circuit performance effects: Does circuit order influence scores?,Medical Teacher,2016,10.3109/0142159x.2015.1075647,https://experts.mcmaster.ca/display/publication681074,2025-07-27T15:06:41.097227
Lawrence Grierson,griersle@mcmaster.ca,journal_articles,Family medicine residents' practice intentions: Theory of planned behaviour evaluation.,Canadian Family Physician,2015,,https://experts.mcmaster.ca/display/publication280065,2025-07-27T15:06:41.097231
Lawrence Grierson,griersle@mcmaster.ca,journal_articles,Manipulation of cognitive load variables and impact on auscultation test performance,Advances in Health Sciences Education,2015,10.1007/s10459-014-9573-x,https://experts.mcmaster.ca/display/publication280033,2025-07-27T15:06:41.097235
Lawrence Grierson,griersle@mcmaster.ca,journal_articles,The impact of an arts-based programme on the affective and cognitive components of empathic development,Medical Humanities,2015,10.1136/medhum-2014-010584,https://experts.mcmaster.ca/display/publication530352,2025-07-27T15:06:41.097371
Lawrence Grierson,griersle@mcmaster.ca,journal_articles,Evaluating the impact of high- and low-fidelity instruction in the development of auscultation skills,Medical Education,2015,10.1111/medu.12653,https://experts.mcmaster.ca/display/publication1519532,2025-07-27T15:06:41.097423
Lawrence Grierson,griersle@mcmaster.ca,journal_articles,The impacts of observing flawed and flawless demonstrations on clinical skill learning,Medical Education,2015,10.1111/medu.12631,https://experts.mcmaster.ca/display/publication918343,2025-07-27T15:06:41.097439
Lawrence Grierson,griersle@mcmaster.ca,journal_articles,The Influence of Visual Feedback and Prior Knowledge About Feedback on Vertical Aiming Strategies,Journal of Motor Behavior,2014,10.1080/00222895.2014.933767,https://experts.mcmaster.ca/display/publication245437,2025-07-27T15:06:41.097442
Lawrence Grierson,griersle@mcmaster.ca,journal_articles,Predicting international medical graduate success on college certification examinations: responding to the Thomson and Cohl judicial report on IMG selection.,Canadian Family Physician,2014,,https://experts.mcmaster.ca/display/publication735265,2025-07-27T15:06:41.097446
Lawrence Grierson,griersle@mcmaster.ca,journal_articles,"Information processing, specificity of practice, and the transfer of learning: considerations for reconsidering fidelity",Advances in Health Sciences Education,2014,10.1007/s10459-014-9504-x,https://experts.mcmaster.ca/display/publication1519534,2025-07-27T15:06:41.097449
Lawrence Grierson,griersle@mcmaster.ca,journal_articles,Revising the tortoise,Medical Education,2014,10.1111/medu.12412,https://experts.mcmaster.ca/display/publication1519535,2025-07-27T15:06:41.097452
