faculty_name,faculty_email,publication_type,title,journal,year,doi,url,file_created
Reem Adel Mustafa,mustafr@mcmaster.ca,journal_articles,ASH ISTH NHF WFH 2021 guidelines on the diagnosis of von Willebrand disease,Blood Advances,2021,10.1182/bloodadvances.2020003265,https://experts.mcmaster.ca/display/publication1959691,2025-07-27T15:11:20.205394
Reem Adel Mustafa,mustafr@mcmaster.ca,journal_articles,ASH ISTH NHF WFH 2021 guidelines on the management of von Willebrand disease,Blood Advances,2021,10.1182/bloodadvances.2020003264,https://experts.mcmaster.ca/display/publication1959292,2025-07-27T15:11:20.205395
Reem Adel Mustafa,mustafr@mcmaster.ca,journal_articles,Developing trustworthy recommendations as part of an urgent response (1–2 weeks): a GRADE concept paper,Journal of Clinical Epidemiology,2021,10.1016/j.jclinepi.2020.09.037,https://experts.mcmaster.ca/display/publication1928076,2025-07-27T15:11:20.205396
Reem Adel Mustafa,mustafr@mcmaster.ca,journal_articles,GRADE Guidelines 30: the GRADE approach to assessing the certainty of modeled evidence—An overview in the context of health decision-making,Journal of Clinical Epidemiology,2021,10.1016/j.jclinepi.2020.09.018,https://experts.mcmaster.ca/display/publication1927441,2025-07-27T15:11:20.205397
Reem Adel Mustafa,mustafr@mcmaster.ca,journal_articles,GRADE Guidelines: 29. Rating the certainty in time-to-event outcomes—Study limitations due to censoring of participants with missing data in intervention studies,Journal of Clinical Epidemiology,2021,10.1016/j.jclinepi.2020.09.017,https://experts.mcmaster.ca/display/publication1928385,2025-07-27T15:11:20.205398
Reem Adel Mustafa,mustafr@mcmaster.ca,journal_articles,Patient-reported outcome measures for pain in autosomal dominant polycystic kidney disease: A systematic review,PLoS ONE,2021,10.1371/journal.pone.0252479,https://experts.mcmaster.ca/display/publication1970291,2025-07-27T15:11:20.205399
Reem Adel Mustafa,mustafr@mcmaster.ca,journal_articles,"The quality of physical activity guidelines, but not the specificity of their recommendations, has improved over time: a systematic review and critical appraisal","Applied Physiology, Nutrition and Metabolism",2021,10.1139/apnm-2020-0378,https://experts.mcmaster.ca/display/publication1927628,2025-07-27T15:11:20.205400
Reem Adel Mustafa,mustafr@mcmaster.ca,journal_articles,Approaches of integrating the development of guidelines and quality indicators: a systematic review,BMC Health Services Research,2020,10.1186/s12913-020-05665-w,https://experts.mcmaster.ca/display/publication1925977,2025-07-27T15:11:20.205401
Reem Adel Mustafa,mustafr@mcmaster.ca,journal_articles,Protocol for the development of guidance for stakeholder engagement in health and healthcare guideline development and implementation,Systematic Reviews,2020,10.1186/s13643-020-1272-5,https://experts.mcmaster.ca/display/publication1689163,2025-07-27T15:11:20.205402
Reem Adel Mustafa,mustafr@mcmaster.ca,journal_articles,AGA Institute Rapid Review and Recommendations on the Role of Pre-Procedure SARS-CoV-2 Testing and Endoscopy,Gastroenterology,2020,10.1053/j.gastro.2020.07.043,https://experts.mcmaster.ca/display/publication1920065,2025-07-27T15:11:20.205433
Reem Adel Mustafa,mustafr@mcmaster.ca,journal_articles,"Using GRADE in situations of emergencies and urgencies: certainty in evidence and recommendations matters during the COVID-19 pandemic, now more than ever and no matter what",Journal of Clinical Epidemiology,2020,10.1016/j.jclinepi.2020.05.030,https://experts.mcmaster.ca/display/publication1914475,2025-07-27T15:11:20.205434
Reem Adel Mustafa,mustafr@mcmaster.ca,journal_articles,Assessing the process and outcome of the development of practice guidelines and recommendations: PANELVIEW instrument development,CANADIAN MEDICAL ASSOCIATION JOURNAL,2020,10.1503/cmaj.200193,https://experts.mcmaster.ca/display/publication1928401,2025-07-27T15:11:20.205435
Reem Adel Mustafa,mustafr@mcmaster.ca,journal_articles,Good practice statements (GPS) for the clinical care of patients with thrombotic thrombocytopenic purpura,Journal of Thrombosis and Haemostasis,2020,10.1111/jth.15009,https://experts.mcmaster.ca/display/publication1926003,2025-07-27T15:11:20.205436
Reem Adel Mustafa,mustafr@mcmaster.ca,journal_articles,ISTH guidelines for the diagnosis of thrombotic thrombocytopenic purpura,Journal of Thrombosis and Haemostasis,2020,10.1111/jth.15006,https://experts.mcmaster.ca/display/publication1926001,2025-07-27T15:11:20.205437
Reem Adel Mustafa,mustafr@mcmaster.ca,journal_articles,ISTH guidelines for treatment of thrombotic thrombocytopenic purpura,Journal of Thrombosis and Haemostasis,2020,10.1111/jth.15010,https://experts.mcmaster.ca/display/publication1926002,2025-07-27T15:11:20.205438
Reem Adel Mustafa,mustafr@mcmaster.ca,journal_articles,Use of facemasks during the COVID-19 pandemic,The Lancet Respiratory Medicine,2020,10.1016/s2213-2600(20)30352-0,https://experts.mcmaster.ca/display/publication1920648,2025-07-27T15:11:20.205439
Reem Adel Mustafa,mustafr@mcmaster.ca,journal_articles,Systematic review and meta-analysis of test accuracy for the diagnosis of suspected pulmonary embolism,Blood Advances,2020,10.1182/bloodadvances.2019001052,https://experts.mcmaster.ca/display/publication1926068,2025-07-27T15:11:20.205440
Reem Adel Mustafa,mustafr@mcmaster.ca,journal_articles,Core Outcome Domains for Trials in Autosomal Dominant Polycystic Kidney Disease: An International Delphi Survey,American Journal of Kidney Diseases,2020,10.1053/j.ajkd.2020.01.005,https://experts.mcmaster.ca/display/publication1895952,2025-07-27T15:11:20.205441
Reem Adel Mustafa,mustafr@mcmaster.ca,journal_articles,Potential impact of missing outcome data on treatment effects in systematic reviews: imputation study,The BMJ,2020,10.1136/bmj.m2898,https://experts.mcmaster.ca/display/publication1924101,2025-07-27T15:11:20.205442
Reem Adel Mustafa,mustafr@mcmaster.ca,journal_articles,"Guideline developers in the United States were inconsistent in applying criteria for appropriate Grading of Recommendations, Assessment, Development and Evaluation use",Journal of Clinical Epidemiology,2020,10.1016/j.jclinepi.2020.01.026,https://experts.mcmaster.ca/display/publication1697056,2025-07-27T15:11:20.205443
Reem Adel Mustafa,mustafr@mcmaster.ca,journal_articles,QIPS CURE: Implementing a Quality Improvement and Patient Safety Curriculum and Resident Experience,Journal of graduate medical education,2020,10.4300/jgme-d-19-00612.1,https://experts.mcmaster.ca/display/publication1939579,2025-07-27T15:11:20.205444
Reem Adel Mustafa,mustafr@mcmaster.ca,journal_articles,Drug treatments for covid-19: living systematic review and network meta-analysis,The BMJ,2020,10.1136/bmj.m2980,https://experts.mcmaster.ca/display/publication1919614,2025-07-27T15:11:20.205445
Reem Adel Mustafa,mustafr@mcmaster.ca,journal_articles,Systematic review and meta-analysis of outcomes in patients with suspected deep vein thrombosis,Blood Advances,2020,10.1182/bloodadvances.2020001558,https://experts.mcmaster.ca/display/publication1915911,2025-07-27T15:11:20.205446
Reem Adel Mustafa,mustafr@mcmaster.ca,journal_articles,Diagnosis of deep vein thrombosis of the upper extremity: a systematic review and meta-analysis of test accuracy,Blood Advances,2020,10.1182/bloodadvances.2019001409,https://experts.mcmaster.ca/display/publication1914474,2025-07-27T15:11:20.205447
Reem Adel Mustafa,mustafr@mcmaster.ca,journal_articles,"GRADE guidelines: 21 part 1. Study design, risk of bias, and indirectness in rating the certainty across a body of evidence for test accuracy",Journal of Clinical Epidemiology,2020,10.1016/j.jclinepi.2019.12.020,https://experts.mcmaster.ca/display/publication1692254,2025-07-27T15:11:20.205455
Reem Adel Mustafa,mustafr@mcmaster.ca,journal_articles,"GRADE guidelines: 21 part 2. Test accuracy: inconsistency, imprecision, publication bias, and other domains for rating the certainty of evidence and presenting it in evidence profiles and summary of findings tables",Journal of Clinical Epidemiology,2020,10.1016/j.jclinepi.2019.12.021,https://experts.mcmaster.ca/display/publication1692253,2025-07-27T15:11:20.205457
Reem Adel Mustafa,mustafr@mcmaster.ca,journal_articles,"Methodology for the American Society of Hematology VTE guidelines: current best practice, innovations, and experiences",Blood Advances,2020,10.1182/bloodadvances.2020001768,https://experts.mcmaster.ca/display/publication1910855,2025-07-27T15:11:20.205458
Reem Adel Mustafa,mustafr@mcmaster.ca,journal_articles,GRADE Guidelines 28: Use of GRADE for the assessment of evidence about prognostic factors: rating certainty in identification of groups of patients with different absolute risks,Journal of Clinical Epidemiology,2020,10.1016/j.jclinepi.2019.12.023,https://experts.mcmaster.ca/display/publication1688441,2025-07-27T15:11:20.205459
Reem Adel Mustafa,mustafr@mcmaster.ca,journal_articles,Diagnosis of deep vein thrombosis of the lower extremity: a systematic review and meta-analysis of test accuracy,Blood Advances,2020,10.1182/bloodadvances.2019000960,https://experts.mcmaster.ca/display/publication1701960,2025-07-27T15:11:20.205460
Reem Adel Mustafa,mustafr@mcmaster.ca,journal_articles,Screening for Colorectal Cancer in Asymptomatic Average-Risk Adults,ACP journal club,2020,10.7326/l20-0115,https://experts.mcmaster.ca/display/publication1703671,2025-07-27T15:11:20.205461
Reem Adel Mustafa,mustafr@mcmaster.ca,journal_articles,"Grading of Recommendations Assessment, Development, and Evaluations (GRADE) notes: extremely serious, GRADE's terminology for rating down by three levels",Journal of Clinical Epidemiology,2020,10.1016/j.jclinepi.2019.11.019,https://experts.mcmaster.ca/display/publication1684910,2025-07-27T15:11:20.205462
Reem Adel Mustafa,mustafr@mcmaster.ca,journal_articles,GRADE guidelines 26: informative statements to communicate the findings of systematic reviews of interventions,Journal of Clinical Epidemiology,2020,10.1016/j.jclinepi.2019.10.014,https://experts.mcmaster.ca/display/publication1676921,2025-07-27T15:11:20.205463
Reem Adel Mustafa,mustafr@mcmaster.ca,journal_articles,A Theoretical Framework and Competency-Based Approach to Training in Guideline Development,Journal of General Internal Medicine,2020,10.1007/s11606-019-05502-9,https://experts.mcmaster.ca/display/publication1678400,2025-07-27T15:11:20.205464
Reem Adel Mustafa,mustafr@mcmaster.ca,journal_articles,AGA Clinical Practice Guidelines on Management of Gastric Intestinal Metaplasia,Gastroenterology,2020,10.1053/j.gastro.2019.12.003,https://experts.mcmaster.ca/display/publication1683391,2025-07-27T15:11:20.205465
Reem Adel Mustafa,mustafr@mcmaster.ca,journal_articles,AGA Technical Review on Gastric Intestinal Metaplasia—Epidemiology and Risk Factors,Gastroenterology,2020,10.1053/j.gastro.2019.12.002,https://experts.mcmaster.ca/display/publication1683388,2025-07-27T15:11:20.205466
Reem Adel Mustafa,mustafr@mcmaster.ca,journal_articles,AGA Technical Review on Gastric Intestinal Metaplasia—Natural History and Clinical Outcomes,Gastroenterology,2020,10.1053/j.gastro.2019.12.001,https://experts.mcmaster.ca/display/publication1683387,2025-07-27T15:11:20.205467
Reem Adel Mustafa,mustafr@mcmaster.ca,journal_articles,Advancing the Science in Gastric Pre-Neoplasia: Study Design Considerations,Gastroenterology,2020,10.1053/j.gastro.2019.12.005,https://experts.mcmaster.ca/display/publication1686936,2025-07-27T15:11:20.205468
Reem Adel Mustafa,mustafr@mcmaster.ca,journal_articles,GRADE guidelines 27: how to calculate absolute effects for time-to-event outcomes in summary of findings tables and Evidence Profiles,Journal of Clinical Epidemiology,2020,10.1016/j.jclinepi.2019.10.015,https://experts.mcmaster.ca/display/publication1676920,2025-07-27T15:11:20.205469
Reem Adel Mustafa,mustafr@mcmaster.ca,journal_articles,Histologic Subtyping of Gastric Intestinal Metaplasia: Overview and Considerations for Clinical Practice,Gastroenterology,2020,10.1053/j.gastro.2019.12.004,https://experts.mcmaster.ca/display/publication1693091,2025-07-27T15:11:20.205470
Reem Adel Mustafa,mustafr@mcmaster.ca,journal_articles,Spotlight: Gastric Intestinal Metaplasia,Gastroenterology,2020,10.1053/j.gastro.2020.01.012,https://experts.mcmaster.ca/display/publication1693090,2025-07-27T15:11:20.205471
Reem Adel Mustafa,mustafr@mcmaster.ca,journal_articles,Testosterone Treatment in Adult Men With Age-Related Low Testosterone: A Clinical Guideline From the American College of Physicians,ACP journal club,2020,10.7326/m19-0882,https://experts.mcmaster.ca/display/publication1741277,2025-07-27T15:11:20.205472
Reem Adel Mustafa,mustafr@mcmaster.ca,journal_articles,Guidelines for reporting case studies and series on drug-induced QT interval prolongation and its complications following acute overdose,Clinical Toxicology,2020,10.1080/15563650.2019.1605077,https://experts.mcmaster.ca/display/publication1639776,2025-07-27T15:11:20.205473
Reem Adel Mustafa,mustafr@mcmaster.ca,journal_articles,<p>Meta-Analyses Proved Inconsistent in How Missing Data Were Handled Across Their Included Primary Trials: A Methodological Survey</p>,Clinical Epidemiology,2020,10.2147/clep.s242080,https://experts.mcmaster.ca/display/publication1914868,2025-07-27T15:11:20.205478
Reem Adel Mustafa,mustafr@mcmaster.ca,journal_articles,An international survey to inform priorities for new guidelines on von Willebrand disease,Haemophilia,2020,10.1111/hae.13881,https://experts.mcmaster.ca/display/publication1680493,2025-07-27T15:11:20.205479
Reem Adel Mustafa,mustafr@mcmaster.ca,journal_articles,CSN COVID-19 Rapid Review Program: Management of Acute Kidney Injury,Canadian Journal of Kidney Health and Disease,2020,10.1177/2054358120941679,https://experts.mcmaster.ca/display/publication1919219,2025-07-27T15:11:20.205480
Reem Adel Mustafa,mustafr@mcmaster.ca,journal_articles,Canadian Society of Nephrology COVID-19 Rapid Response Team Home Dialysis Recommendations,Canadian Journal of Kidney Health and Disease,2020,10.1177/2054358120928153,https://experts.mcmaster.ca/display/publication1914760,2025-07-27T15:11:20.205481
Reem Adel Mustafa,mustafr@mcmaster.ca,journal_articles,"Canadian Society of Nephrology Commentary on the Kidney Disease Improving           Global Outcomes 2017 Clinical Practice Guideline Update for the Diagnosis, Evaluation,           Prevention, and Treatment of Chronic Kidney Disease-Mineral and Bone           Disorder",Canadian Journal of Kidney Health and Disease,2020,10.1177/2054358120944271,https://experts.mcmaster.ca/display/publication1920505,2025-07-27T15:11:20.205482
Reem Adel Mustafa,mustafr@mcmaster.ca,journal_articles,Defining ranges for certainty ratings of diagnostic accuracy: a GRADE concept paper,Journal of Clinical Epidemiology,2020,10.1016/j.jclinepi.2019.05.002,https://experts.mcmaster.ca/display/publication1641990,2025-07-27T15:11:20.205483
Reem Adel Mustafa,mustafr@mcmaster.ca,journal_articles,Guidelines about physical activity and exercise to reduce cardiometabolic risk factors: protocol for a systematic review and critical appraisal,BMJ Open,2020,10.1136/bmjopen-2019-032656,https://experts.mcmaster.ca/display/publication1688612,2025-07-27T15:11:20.205484
Reem Adel Mustafa,mustafr@mcmaster.ca,journal_articles,Handling of Missing Data,Transplantation,2020,10.1097/tp.0000000000002865,https://experts.mcmaster.ca/display/publication1658915,2025-07-27T15:11:20.205485
Reem Adel Mustafa,mustafr@mcmaster.ca,journal_articles,"Major Outcomes With Personalized Dialysate TEMPerature (MyTEMP): Rationale and Design of a Pragmatic, Registry-Based, Cluster Randomized Controlled Trial",Canadian Journal of Kidney Health and Disease,2020,10.1177/2054358119887988,https://experts.mcmaster.ca/display/publication1693799,2025-07-27T15:11:20.205486
Reem Adel Mustafa,mustafr@mcmaster.ca,journal_articles,Management of Outpatient Hemodialysis During the COVID-19 Pandemic: Recommendations From the Canadian Society of Nephrology COVID-19 Rapid Response Team,Canadian Journal of Kidney Health and Disease,2020,10.1177/2054358120938564,https://experts.mcmaster.ca/display/publication1927568,2025-07-27T15:11:20.205487
Reem Adel Mustafa,mustafr@mcmaster.ca,journal_articles,Management of Patients With Glomerulonephritis During the COVID-19 Pandemic: Recommendations From the Canadian Society of Nephrology COVID-19 Rapid Response Team,Canadian Journal of Kidney Health and Disease,2020,10.1177/2054358120968955,https://experts.mcmaster.ca/display/publication1940314,2025-07-27T15:11:20.205488
Reem Adel Mustafa,mustafr@mcmaster.ca,journal_articles,The CSN COVID-19 Rapid Response Program,Canadian Journal of Kidney Health and Disease,2020,10.1177/2054358120949110,https://experts.mcmaster.ca/display/publication1936800,2025-07-27T15:11:20.205489
Reem Adel Mustafa,mustafr@mcmaster.ca,journal_articles,"2019 sickle cell disease guidelines by the American Society of Hematology: methodology, challenges, and innovations",Blood Advances,2019,10.1182/bloodadvances.2019000931,https://experts.mcmaster.ca/display/publication1683390,2025-07-27T15:11:20.205490
Reem Adel Mustafa,mustafr@mcmaster.ca,journal_articles,American Society of Hematology 2019 guidelines for sickle cell disease: cardiopulmonary and kidney disease,Blood Advances,2019,10.1182/bloodadvances.2019000916,https://experts.mcmaster.ca/display/publication1683389,2025-07-27T15:11:20.205491
Reem Adel Mustafa,mustafr@mcmaster.ca,journal_articles,Screening for Colorectal Cancer in Asymptomatic Average-Risk Adults: A Guidance Statement From the American College of Physicians,ACP journal club,2019,10.7326/m19-0642,https://experts.mcmaster.ca/display/publication1676949,2025-07-27T15:11:20.205492
Reem Adel Mustafa,mustafr@mcmaster.ca,journal_articles,Development of the summary of findings table for network meta-analysis,Journal of Clinical Epidemiology,2019,10.1016/j.jclinepi.2019.04.018,https://experts.mcmaster.ca/display/publication1640434,2025-07-27T15:11:20.205493
Reem Adel Mustafa,mustafr@mcmaster.ca,journal_articles,Annals On Call - Making Sense of Breast Cancer Screening Guidelines,ACP journal club,2019,10.7326/a19-0015,https://experts.mcmaster.ca/display/publication1671326,2025-07-27T15:11:20.205494
Reem Adel Mustafa,mustafr@mcmaster.ca,journal_articles,Screening for Breast Cancer in Average-Risk Women,ACP journal club,2019,10.7326/l19-0474,https://experts.mcmaster.ca/display/publication1665684,2025-07-27T15:11:20.205495
Reem Adel Mustafa,mustafr@mcmaster.ca,journal_articles,The Development of Clinical Guidelines and Guidance Statements by the Clinical Guidelines Committee of the American College of Physicians: Update of Methods,ACP journal club,2019,10.7326/m18-3290,https://experts.mcmaster.ca/display/publication1644760,2025-07-27T15:11:20.205496
Reem Adel Mustafa,mustafr@mcmaster.ca,journal_articles,Screening for Breast Cancer in Average-Risk Women: A Guidance Statement From the American College of Physicians,ACP journal club,2019,10.7326/m18-2147,https://experts.mcmaster.ca/display/publication1637355,2025-07-27T15:11:20.205497
Reem Adel Mustafa,mustafr@mcmaster.ca,journal_articles,GRADE approach to rate the certainty from a network meta-analysis: addressing incoherence,Journal of Clinical Epidemiology,2019,10.1016/j.jclinepi.2018.11.025,https://experts.mcmaster.ca/display/publication1612217,2025-07-27T15:11:20.205498
Reem Adel Mustafa,mustafr@mcmaster.ca,journal_articles,A risk of bias instrument for non-randomized studies of exposures: A users’ guide to its application in the context of GRADE,Environment International,2019,10.1016/j.envint.2018.11.004,https://experts.mcmaster.ca/display/publication1609579,2025-07-27T15:11:20.205499
Reem Adel Mustafa,mustafr@mcmaster.ca,journal_articles,Cultivating Innovative Pragmatic Cluster-Randomized Registry Trials Embedded in Hemodialysis Care: Workshop Proceedings From 2018,Canadian Journal of Kidney Health and Disease,2019,10.1177/2054358119894394,https://experts.mcmaster.ca/display/publication1686677,2025-07-27T15:11:20.205500
Reem Adel Mustafa,mustafr@mcmaster.ca,journal_articles,GRADE Guidelines: 22. The GRADE approach for tests and strategies-from test accuracy to patient important outcomes and recommendations,Journal of Clinical Epidemiology,2019,10.1016/j.jclinepi.2019.02.003,https://experts.mcmaster.ca/display/publication1627091,2025-07-27T15:11:20.205501
Reem Adel Mustafa,mustafr@mcmaster.ca,journal_articles,Potentially missing data are considerably more frequent than definitely missing data: a methodological survey of 638 randomized controlled trials,Journal of Clinical Epidemiology,2019,10.1016/j.jclinepi.2018.10.001,https://experts.mcmaster.ca/display/publication1599948,2025-07-27T15:11:20.205502
Reem Adel Mustafa,mustafr@mcmaster.ca,journal_articles,American Society of Hematology 2018 Guidelines for management of venous thromboembolism: treatment of pediatric venous thromboembolism,Blood Advances,2018,10.1182/bloodadvances.2018024786,https://experts.mcmaster.ca/display/publication1612191,2025-07-27T15:11:20.205503
Reem Adel Mustafa,mustafr@mcmaster.ca,journal_articles,American Society of Hematology 2018 guidelines for management of venous thromboembolism: diagnosis of venous thromboembolism,Blood Advances,2018,10.1182/bloodadvances.2018024828,https://experts.mcmaster.ca/display/publication1610878,2025-07-27T15:11:20.205504
Reem Adel Mustafa,mustafr@mcmaster.ca,journal_articles,American Society of Hematology 2018 guidelines for management of venous thromboembolism: heparin-induced thrombocytopenia,Blood Advances,2018,10.1182/bloodadvances.2018024489,https://experts.mcmaster.ca/display/publication1612254,2025-07-27T15:11:20.205505
Reem Adel Mustafa,mustafr@mcmaster.ca,journal_articles,Guidance was developed on how to write a plain language summary for diagnostic test accuracy reviews,Journal of Clinical Epidemiology,2018,10.1016/j.jclinepi.2018.07.008,https://experts.mcmaster.ca/display/publication1600066,2025-07-27T15:11:20.205506
Reem Adel Mustafa,mustafr@mcmaster.ca,journal_articles,A Practical Guide for Treatment of Rapidly Progressive ADPKD with Tolvaptan,Journal of the American Society of Nephrology,2018,10.1681/asn.2018060590,https://experts.mcmaster.ca/display/publication1596018,2025-07-27T15:11:20.205507
Reem Adel Mustafa,mustafr@mcmaster.ca,journal_articles,Burden of Proof for Tolvaptan in ADPKD,American Society of Nephrology. Clinical Journal,2018,10.2215/cjn.00190118,https://experts.mcmaster.ca/display/publication1513087,2025-07-27T15:11:20.205508
Reem Adel Mustafa,mustafr@mcmaster.ca,journal_articles,Corrigendum to “Advances in the GRADE approach to rate the certainty in estimates from a network meta-analysis” [J Clin Epidemiol 2018;93:36-44],Journal of Clinical Epidemiology,2018,10.1016/j.jclinepi.2018.04.013,https://experts.mcmaster.ca/display/publication1541909,2025-07-27T15:11:20.205509
Reem Adel Mustafa,mustafr@mcmaster.ca,journal_articles,Have We Not Learned from Past Mistakes?,American Journal of Respiratory and Critical Care Medicine,2018,10.1164/rccm.201711-2200le,https://experts.mcmaster.ca/display/publication1492564,2025-07-27T15:11:20.205510
Reem Adel Mustafa,mustafr@mcmaster.ca,journal_articles,Advancing Guideline Development in the United States: A Call to Action by the US GRADE Network,American Journal of Medical Quality,2018,10.1177/1062860617726855,https://experts.mcmaster.ca/display/publication1447304,2025-07-27T15:11:20.205512
Reem Adel Mustafa,mustafr@mcmaster.ca,journal_articles,Advances in the GRADE approach to rate the certainty in estimates from a network meta-analysis,Journal of Clinical Epidemiology,2018,10.1016/j.jclinepi.2017.10.005,https://experts.mcmaster.ca/display/publication1467890,2025-07-27T15:11:20.205513
Reem Adel Mustafa,mustafr@mcmaster.ca,journal_articles,Developing Evidence to Decision frameworks and an interactive Evidence to Decision tool for making and using decisions and recommendations in health care,Global Challenges,2018,10.1002/gch2.201700081,https://experts.mcmaster.ca/display/publication1634073,2025-07-27T15:11:20.205514
Reem Adel Mustafa,mustafr@mcmaster.ca,journal_articles,Do clinicians want recommendations? A multicenter study comparing evidence summaries with and without GRADE recommendations,Journal of Clinical Epidemiology,2018,10.1016/j.jclinepi.2018.02.026,https://experts.mcmaster.ca/display/publication1504982,2025-07-27T15:11:20.205515
Reem Adel Mustafa,mustafr@mcmaster.ca,journal_articles,GRADE Evidence to Decision (EtD) frameworks: a systematic and transparent approach to making well informed healthcare choices. 2: Clinical practice guidelines,Gaceta Sanitaria,2018,10.1016/j.gaceta.2017.03.008,https://experts.mcmaster.ca/display/publication1460197,2025-07-27T15:11:20.205516
Reem Adel Mustafa,mustafr@mcmaster.ca,journal_articles,GRADE Guidelines: 19. Assessing the certainty of evidence in the importance of outcomes or values and preferences—Risk of bias and indirectness,Journal of Clinical Epidemiology,2018,10.1016/j.jclinepi.2018.01.013,https://experts.mcmaster.ca/display/publication1501102,2025-07-27T15:11:20.205517
Reem Adel Mustafa,mustafr@mcmaster.ca,journal_articles,GRADE guidelines: 18. How ROBINS-I and other tools to assess risk of bias in nonrandomized studies should be used to rate the certainty of a body of evidence,Journal of Clinical Epidemiology,2018,10.1016/j.jclinepi.2018.01.012,https://experts.mcmaster.ca/display/publication1497441,2025-07-27T15:11:20.205518
Reem Adel Mustafa,mustafr@mcmaster.ca,journal_articles,"GRADE guidelines: 20. Assessing the certainty of evidence in the importance of outcomes or values and preferences—inconsistency, imprecision, and other domains",Journal of Clinical Epidemiology,2018,10.1016/j.jclinepi.2018.05.011,https://experts.mcmaster.ca/display/publication1541180,2025-07-27T15:11:20.205519
