faculty_name,faculty_email,publication_type,title,journal,year,doi,url,file_created
Reem Adel Mustafa,mustafr@mcmaster.ca,journal_articles,Marcos GRADE de la evidencia a la decisión (EtD): un enfoque sistemático y transparente para tomar decisiones sanitarias bien informadas. 1: Introducción,Gaceta Sanitaria,2018,10.1016/j.gaceta.2017.02.010,https://experts.mcmaster.ca/display/publication1447306,2025-07-27T15:11:20.205520
Reem Adel Mustafa,mustafr@mcmaster.ca,journal_articles,Systematic reviews do not adequately report or address missing outcome data in their analyses: a methodological survey,Journal of Clinical Epidemiology,2018,10.1016/j.jclinepi.2018.02.016,https://experts.mcmaster.ca/display/publication1505136,2025-07-27T15:11:20.205521
Reem Adel Mustafa,mustafr@mcmaster.ca,journal_articles,Barriers and facilitators to healthcare professional behaviour change in clinical trials using the Theoretical Domains Framework: a case study of a trial of individualized temperature-reduced haemodialysis,Trials,2017,10.1186/s13063-017-1965-9,https://experts.mcmaster.ca/display/publication1545539,2025-07-27T15:11:20.205522
Reem Adel Mustafa,mustafr@mcmaster.ca,journal_articles,Decision making about healthcare-related tests and diagnostic test strategies. Paper 1: a new series on testing to improve people's health,Journal of Clinical Epidemiology,2017,10.1016/j.jclinepi.2017.09.006,https://experts.mcmaster.ca/display/publication1482804,2025-07-27T15:11:20.205523
Reem Adel Mustafa,mustafr@mcmaster.ca,journal_articles,Decision making about healthcare-related tests and diagnostic test strategies. Paper 2: a review of methodological and practical challenges,Journal of Clinical Epidemiology,2017,10.1016/j.jclinepi.2017.09.003,https://experts.mcmaster.ca/display/publication1458554,2025-07-27T15:11:20.205524
Reem Adel Mustafa,mustafr@mcmaster.ca,journal_articles,Decision making about healthcare-related tests and diagnostic test strategies. Paper 3: a systematic review shows limitations in most tools designed to assess quality and develop recommendations,Journal of Clinical Epidemiology,2017,10.1016/j.jclinepi.2017.09.007,https://experts.mcmaster.ca/display/publication1458553,2025-07-27T15:11:20.205525
Reem Adel Mustafa,mustafr@mcmaster.ca,journal_articles,Decision making about healthcare-related tests and diagnostic test strategies. Paper 4: International guidelines show variability in their approaches,Journal of Clinical Epidemiology,2017,10.1016/j.jclinepi.2017.09.004,https://experts.mcmaster.ca/display/publication1458551,2025-07-27T15:11:20.205527
Reem Adel Mustafa,mustafr@mcmaster.ca,journal_articles,Decision making about healthcare-related tests and diagnostic test strategies. Paper 5: a qualitative study with experts suggests that test accuracy data alone is rarely sufficient for decision making,Journal of Clinical Epidemiology,2017,10.1016/j.jclinepi.2017.09.005,https://experts.mcmaster.ca/display/publication1458552,2025-07-27T15:11:20.205528
Reem Adel Mustafa,mustafr@mcmaster.ca,journal_articles,Comparison of the Frequency of Acute Kidney Injury in Patients With Renal Transplant Who Underwent Percutaneous Coronary Intervention Versus Coronary Artery Bypass Graft Surgery,American Journal of Cardiology,2017,10.1016/j.amjcard.2017.06.047,https://experts.mcmaster.ca/display/publication1447305,2025-07-27T15:11:20.205536
Reem Adel Mustafa,mustafr@mcmaster.ca,journal_articles,What does expert opinion in guidelines mean? a meta-epidemiological study,BMJ Evidence-Based Medicine,2017,10.1136/ebmed-2017-110798,https://experts.mcmaster.ca/display/publication1458547,2025-07-27T15:11:20.205539
Reem Adel Mustafa,mustafr@mcmaster.ca,journal_articles,Comment on “Perspective: NutriGrade: A Scoring System to Assess and Judge the Meta-Evidence of Randomized Controlled Trials and Cohort Studies in Nutrition Research”,Advances in Nutrition,2017,10.3945/an.117.016188,https://experts.mcmaster.ca/display/publication1460198,2025-07-27T15:11:20.205540
Reem Adel Mustafa,mustafr@mcmaster.ca,journal_articles,STARD for Abstracts: essential items for reporting diagnostic accuracy studies in journal or conference abstracts,The BMJ,2017,10.1136/bmj.j3751,https://experts.mcmaster.ca/display/publication1747800,2025-07-27T15:11:20.205541
Reem Adel Mustafa,mustafr@mcmaster.ca,journal_articles,Cytology versus HPV testing for cervical cancer screening in the general population,Cochrane Database of Systematic Reviews,2017,10.1002/14651858.cd008587.pub2,https://experts.mcmaster.ca/display/publication1432541,2025-07-27T15:11:20.205542
Reem Adel Mustafa,mustafr@mcmaster.ca,journal_articles,Guidance for Modifying the Definition of Diseases,JAMA Internal Medicine,2017,10.1001/jamainternmed.2017.1302,https://experts.mcmaster.ca/display/publication1018172,2025-07-27T15:11:20.205543
Reem Adel Mustafa,mustafr@mcmaster.ca,journal_articles,Applying GRADE to Coverage Decisions: Results of a Stakeholder Survey and Workshop,Journal of Clinical Epidemiology,2017,10.1016/j.jclinepi.2017.02.019,https://experts.mcmaster.ca/display/publication1080022,2025-07-27T15:11:20.205544
Reem Adel Mustafa,mustafr@mcmaster.ca,journal_articles,"Immigration, Graduate Medical Education, and Ethical Dilemmas",Journal of graduate medical education,2017,10.4300/jgme-d-17-00124.1,https://experts.mcmaster.ca/display/publication1750082,2025-07-27T15:11:20.205545
Reem Adel Mustafa,mustafr@mcmaster.ca,journal_articles,Rating the certainty in evidence in the absence of a single estimate of effect,BMJ Evidence-Based Medicine,2017,10.1136/ebmed-2017-110668,https://experts.mcmaster.ca/display/publication1080024,2025-07-27T15:11:20.205546
Reem Adel Mustafa,mustafr@mcmaster.ca,journal_articles,Authors seldom report the most patient-important outcomes and absolute effect measures in systematic review abstracts,Journal of Clinical Epidemiology,2017,10.1016/j.jclinepi.2016.08.004,https://experts.mcmaster.ca/display/publication172755,2025-07-27T15:11:20.205547
Reem Adel Mustafa,mustafr@mcmaster.ca,journal_articles,Choosing Wisely,Canadian Journal of Kidney Health and Disease,2017,10.1177/2054358117695570,https://experts.mcmaster.ca/display/publication587583,2025-07-27T15:11:20.205548
Reem Adel Mustafa,mustafr@mcmaster.ca,journal_articles,"GRADE Evidence to Decision (EtD) frameworks for adoption, adaptation, and de novo development of trustworthy recommendations: GRADE-ADOLOPMENT",Journal of Clinical Epidemiology,2017,10.1016/j.jclinepi.2016.09.009,https://experts.mcmaster.ca/display/publication670942,2025-07-27T15:11:20.205555
Reem Adel Mustafa,mustafr@mcmaster.ca,journal_articles,GRADE guidelines 17: assessing the risk of bias associated with missing participant outcome data in a body of evidence,Journal of Clinical Epidemiology,2017,10.1016/j.jclinepi.2017.05.005,https://experts.mcmaster.ca/display/publication172699,2025-07-27T15:11:20.205556
Reem Adel Mustafa,mustafr@mcmaster.ca,journal_articles,Systematic survey of randomized trials evaluating the impact of alternative diagnostic strategies on patient-important outcomes,Journal of Clinical Epidemiology,2017,10.1016/j.jclinepi.2016.12.009,https://experts.mcmaster.ca/display/publication826469,2025-07-27T15:11:20.205557
Reem Adel Mustafa,mustafr@mcmaster.ca,journal_articles,The GRADE Working Group clarifies the construct of certainty of evidence,Journal of Clinical Epidemiology,2017,10.1016/j.jclinepi.2017.05.006,https://experts.mcmaster.ca/display/publication172700,2025-07-27T15:11:20.205559
Reem Adel Mustafa,mustafr@mcmaster.ca,journal_articles,Using patient values and preferences to inform the importance of health outcomes in practice guideline development following the GRADE approach,Health and Quality of Life Outcomes,2017,10.1186/s12955-017-0621-0,https://experts.mcmaster.ca/display/publication670940,2025-07-27T15:11:20.205560
Reem Adel Mustafa,mustafr@mcmaster.ca,journal_articles,Cinacalcet versus standard treatment for chronic kidney disease: a protocol for a systematic review and meta-analysis,Systematic Reviews,2016,10.1186/s13643-015-0177-1,https://experts.mcmaster.ca/display/publication1017710,2025-07-27T15:11:20.205561
Reem Adel Mustafa,mustafr@mcmaster.ca,journal_articles,Clinical Practice Guidelines on the Screening and Treatment of Precancerous Lesions for Cervical Cancer Prevention in Saudi Arabia,Annals of Saudi Medicine,2016,10.5144/0256-4947.2016.313,https://experts.mcmaster.ca/display/publication626817,2025-07-27T15:11:20.205562
Reem Adel Mustafa,mustafr@mcmaster.ca,journal_articles,Cinacalcet versus standard treatment for chronic kidney disease: a systematic review and meta-analysis,Renal Failure,2016,10.3109/0886022x.2016.1172468,https://experts.mcmaster.ca/display/publication623836,2025-07-27T15:11:20.205563
Reem Adel Mustafa,mustafr@mcmaster.ca,journal_articles,GRADE: Assessing the quality of evidence in environmental and occupational health,Environment International,2016,10.1016/j.envint.2016.01.004,https://experts.mcmaster.ca/display/publication826457,2025-07-27T15:11:20.205564
Reem Adel Mustafa,mustafr@mcmaster.ca,journal_articles,Outcomes of vascular access for hemodialysis: A systematic review and meta-analysis,Journal of Vascular Surgery,2016,10.1016/j.jvs.2016.01.053,https://experts.mcmaster.ca/display/publication826467,2025-07-27T15:11:20.205565
Reem Adel Mustafa,mustafr@mcmaster.ca,journal_articles,Improving GRADE evidence tables part 2: a systematic survey of explanatory notes shows more guidance is needed,Journal of Clinical Epidemiology,2016,10.1016/j.jclinepi.2015.12.008,https://experts.mcmaster.ca/display/publication826460,2025-07-27T15:11:20.205566
Reem Adel Mustafa,mustafr@mcmaster.ca,journal_articles,Rating the quality of evidence is by necessity a matter of judgment,Journal of Clinical Epidemiology,2016,10.1016/j.jclinepi.2015.11.018,https://experts.mcmaster.ca/display/publication1630360,2025-07-27T15:11:20.205567
Reem Adel Mustafa,mustafr@mcmaster.ca,journal_articles,"Systematic reviews and meta-analyses of benefits and harms of cryotherapy, LEEP, and cold knife conization to treat cervical intraepithelial neoplasia",International Journal of Gynecology and Obstetrics,2016,10.1016/j.ijgo.2015.07.026,https://experts.mcmaster.ca/display/publication608885,2025-07-27T15:11:20.205568
Reem Adel Mustafa,mustafr@mcmaster.ca,journal_articles,"Systematic reviews and meta-analyses of the accuracy of HPV tests, visual inspection with acetic acid, cytology, and colposcopy",International Journal of Gynecology and Obstetrics,2016,10.1016/j.ijgo.2015.07.024,https://experts.mcmaster.ca/display/publication608884,2025-07-27T15:11:20.205569
Reem Adel Mustafa,mustafr@mcmaster.ca,journal_articles,World Health Organization Guidelines for treatment of cervical intraepithelial neoplasia 2-3 and screen-and-treat strategies to prevent cervical cancer,International Journal of Gynecology and Obstetrics,2016,10.1016/j.ijgo.2015.07.038,https://experts.mcmaster.ca/display/publication826471,2025-07-27T15:11:20.205570
Reem Adel Mustafa,mustafr@mcmaster.ca,journal_articles,A guide for health professionals to interpret and use recommendations in guidelines developed with the GRADE approach,Journal of Clinical Epidemiology,2016,10.1016/j.jclinepi.2015.11.017,https://experts.mcmaster.ca/display/publication61482,2025-07-27T15:11:20.205571
Reem Adel Mustafa,mustafr@mcmaster.ca,journal_articles,Do clinicians understand the size of treatment effects? A randomized survey across 8 countries,CANADIAN MEDICAL ASSOCIATION JOURNAL,2016,10.1503/cmaj.150430,https://experts.mcmaster.ca/display/publication623828,2025-07-27T15:11:20.205572
Reem Adel Mustafa,mustafr@mcmaster.ca,journal_articles,Effect of lowering the dialysate temperature in chronic hemodialysis: a systematic review and meta-analysis,American Society of Nephrology. Clinical Journal,2016,10.2215/cjn.04580415,https://experts.mcmaster.ca/display/publication826461,2025-07-27T15:11:20.205573
Reem Adel Mustafa,mustafr@mcmaster.ca,journal_articles,GRADE Evidence to Decision (EtD) frameworks: a systematic and transparent approach to making well informed healthcare choices. 1: Introduction,The BMJ,2016,10.1136/bmj.i2089,https://experts.mcmaster.ca/display/publication826463,2025-07-27T15:11:20.205574
Reem Adel Mustafa,mustafr@mcmaster.ca,journal_articles,GRADE Evidence to Decision (EtD) frameworks: a systematic and transparent approach to making well informed healthcare choices. 2: Clinical practice guidelines,The BMJ,2016,10.1136/bmj.i2016,https://experts.mcmaster.ca/display/publication826456,2025-07-27T15:11:20.205575
Reem Adel Mustafa,mustafr@mcmaster.ca,journal_articles,GRADE Guidelines: 16. GRADE evidence to decision frameworks for tests in clinical practice and public health,Journal of Clinical Epidemiology,2016,10.1016/j.jclinepi.2016.01.032,https://experts.mcmaster.ca/display/publication867522,2025-07-27T15:11:20.205594
Reem Adel Mustafa,mustafr@mcmaster.ca,journal_articles,Improving GRADE evidence tables part 1: a randomized trial shows improved understanding of content in summary of findings tables with a new format,Journal of Clinical Epidemiology,2016,10.1016/j.jclinepi.2015.12.007,https://experts.mcmaster.ca/display/publication411219,2025-07-27T15:11:20.205597
Reem Adel Mustafa,mustafr@mcmaster.ca,journal_articles,Improving GRADE evidence tables part 3: detailed guidance for explanatory footnotes supports creating and understanding GRADE certainty in the evidence judgments,Journal of Clinical Epidemiology,2016,10.1016/j.jclinepi.2015.12.006,https://experts.mcmaster.ca/display/publication826462,2025-07-27T15:11:20.205598
Reem Adel Mustafa,mustafr@mcmaster.ca,journal_articles,Systematic reviews experience major limitations in reporting absolute effects,Journal of Clinical Epidemiology,2016,10.1016/j.jclinepi.2015.11.002,https://experts.mcmaster.ca/display/publication172795,2025-07-27T15:11:20.205599
Reem Adel Mustafa,mustafr@mcmaster.ca,journal_articles,STARD 2015: An Updated List of Essential Items for Reporting Diagnostic Accuracy Studies,Clinical Chemistry,2015,10.1373/clinchem.2015.246280,https://experts.mcmaster.ca/display/publication1746605,2025-07-27T15:11:20.205600
Reem Adel Mustafa,mustafr@mcmaster.ca,journal_articles,"Re: Anticoagulation and Antiplatelet Therapy in Urological Practice: ICUD/AUA Review Paper: D. J. Culkin, E. J. Exaire, D. Green, M. S. Soloway, A. J. Gross, M. R. Desai, J. R. White and D. J. Lightner J Urol 2014; 192: 1026-1034",Investigative Urology,2015,10.1016/j.juro.2015.04.087,https://experts.mcmaster.ca/display/publication1630359,2025-07-27T15:11:20.205601
Reem Adel Mustafa,mustafr@mcmaster.ca,journal_articles,Combined general and neuraxial anesthesia versus general anesthesia: a population-based cohort study,Canadian Journal of Anaesthesia,2015,10.1007/s12630-015-0315-1,https://experts.mcmaster.ca/display/publication587700,2025-07-27T15:11:20.205602
Reem Adel Mustafa,mustafr@mcmaster.ca,journal_articles,Canadian Society of Nephrology Commentary on the KDIGO Clinical Practice Guideline for CKD Evaluation and Management,American Journal of Kidney Diseases,2015,10.1053/j.ajkd.2014.10.013,https://experts.mcmaster.ca/display/publication826465,2025-07-27T15:11:20.205603
Reem Adel Mustafa,mustafr@mcmaster.ca,journal_articles,Comparison between the standard and a new alternative format of the Summary-of-Findings tables in Cochrane review users: study protocol for a randomized controlled trial,Trials,2015,10.1186/s13063-015-0649-6,https://experts.mcmaster.ca/display/publication411223,2025-07-27T15:11:20.205605
Reem Adel Mustafa,mustafr@mcmaster.ca,journal_articles,Decision-Making about Healthcare Related Tests and Diagnostic Strategies: User Testing of GRADE Evidence Tables,PLoS ONE,2015,10.1371/journal.pone.0134553,https://experts.mcmaster.ca/display/publication826464,2025-07-27T15:11:20.205605
Reem Adel Mustafa,mustafr@mcmaster.ca,journal_articles,"Reporting, handling and assessing the risk of bias associated with missing participant data in systematic reviews: a methodological survey",BMJ Open,2015,10.1136/bmjopen-2015-009368,https://experts.mcmaster.ca/display/publication172802,2025-07-27T15:11:20.205606
Reem Adel Mustafa,mustafr@mcmaster.ca,journal_articles,The GRADE evidence-to-decision framework: a report of its testing and application in 15 international guideline panels,Implementation Science,2015,10.1186/s13012-016-0462-y,https://experts.mcmaster.ca/display/publication172769,2025-07-27T15:11:20.205607
Reem Adel Mustafa,mustafr@mcmaster.ca,journal_articles,The Saudi clinical practice guideline for the diagnosis of the first deep venous thrombosis of the lower extremity,Annals of Thoracic Medicine,2015,10.4103/1817-1737.146849,https://experts.mcmaster.ca/display/publication626850,2025-07-27T15:11:20.205608
Reem Adel Mustafa,mustafr@mcmaster.ca,journal_articles,Interventions for enhancing medication adherence,Cochrane Database of Systematic Reviews,2014,10.1002/14651858.cd000011.pub4,https://experts.mcmaster.ca/display/publication61512,2025-07-27T15:11:20.205609
Reem Adel Mustafa,mustafr@mcmaster.ca,journal_articles,Guidelines 2.0: Systematic development of a comprehensive checklist for a successful guideline enterprise△,Chinese Journal of Evidence-Based Medicine,2014,10.7507/1672-2531.20140185,https://experts.mcmaster.ca/display/publication1747387,2025-07-27T15:11:20.205611
Reem Adel Mustafa,mustafr@mcmaster.ca,journal_articles,"Applying Grading of Recommendations Assessment, Development and Evaluation (GRADE) to diagnostic tests was challenging but doable",Journal of Clinical Epidemiology,2014,10.1016/j.jclinepi.2014.01.006,https://experts.mcmaster.ca/display/publication826458,2025-07-27T15:11:20.205612
Reem Adel Mustafa,mustafr@mcmaster.ca,journal_articles,Canadian Society of Nephrology 2014 clinical practice guideline for timing the initiation of chronic dialysis,CANADIAN MEDICAL ASSOCIATION JOURNAL,2014,10.1503/cmaj.130363,https://experts.mcmaster.ca/display/publication826474,2025-07-27T15:11:20.205613
Reem Adel Mustafa,mustafr@mcmaster.ca,journal_articles,"A methodological survey of the analysis, reporting and interpretation of Absolute Risk ReductiOn in systematic revieWs (ARROW): a study protocol (vol 2, 113, 2013)",Systematic Reviews,2014,10.1186/2046-4053-2-113,https://experts.mcmaster.ca/display/publication172939,2025-07-27T15:11:20.205614
Reem Adel Mustafa,mustafr@mcmaster.ca,journal_articles,Addressing continuous data measured with different instruments for participants excluded from trial analysis: a guide for systematic reviewers,Journal of Clinical Epidemiology,2014,10.1016/j.jclinepi.2013.11.014,https://experts.mcmaster.ca/display/publication174872,2025-07-27T15:11:20.205615
Reem Adel Mustafa,mustafr@mcmaster.ca,journal_articles,"Erratum to: A methodological survey of the analysis, reporting and interpretation of Absolute Risk ReductiOn in systematic revieWs (ARROW): a study protocol",Systematic Reviews,2014,10.1186/2046-4053-3-76,https://experts.mcmaster.ca/display/publication411199,2025-07-27T15:11:20.205616
Reem Adel Mustafa,mustafr@mcmaster.ca,journal_articles,Guidelines 2.0: systematic development of a comprehensive checklist for a successful guideline enterprise,CANADIAN MEDICAL ASSOCIATION JOURNAL,2014,10.1503/cmaj.131237,https://experts.mcmaster.ca/display/publication670950,2025-07-27T15:11:20.205617
Reem Adel Mustafa,mustafr@mcmaster.ca,journal_articles,Impact of missing participant data for dichotomous outcomes on pooled effect estimates in systematic reviews: a protocol for a methodological study,Systematic Reviews,2014,10.1186/2046-4053-3-137,https://experts.mcmaster.ca/display/publication172871,2025-07-27T15:11:20.205618
Reem Adel Mustafa,mustafr@mcmaster.ca,journal_articles,Methodological survey of designed uneven randomization trials (DU-RANDOM): a protocol,Trials,2014,10.1186/1745-6215-15-33,https://experts.mcmaster.ca/display/publication670949,2025-07-27T15:11:20.205619
Reem Adel Mustafa,mustafr@mcmaster.ca,journal_articles,The Canadian Society of Nephrology Methods in Developing and Adapting Clinical Practice Guidelines: A Review,Canadian Journal of Kidney Health and Disease,2014,10.1186/2054-3581-1-5,https://experts.mcmaster.ca/display/publication270688,2025-07-27T15:11:20.205620
Reem Adel Mustafa,mustafr@mcmaster.ca,journal_articles,Canadian Society of Nephrology Guidelines for the Management of Patients With ESRD Treated With Intensive Hemodialysis,American Journal of Kidney Diseases,2013,10.1053/j.ajkd.2013.02.351,https://experts.mcmaster.ca/display/publication711801,2025-07-27T15:11:20.205621
Reem Adel Mustafa,mustafr@mcmaster.ca,journal_articles,Dialysate Calcium Concentration and Mineral Metabolism in Long and Long-Frequent Hemodialysis: A Systematic Review and Meta-analysis for a Canadian Society of Nephrology Clinical Practice Guideline,American Journal of Kidney Diseases,2013,10.1053/j.ajkd.2013.02.357,https://experts.mcmaster.ca/display/publication711797,2025-07-27T15:11:20.205622
Reem Adel Mustafa,mustafr@mcmaster.ca,journal_articles,Vascular Access for Intensive Maintenance Hemodialysis: A Systematic Review for a Canadian Society of Nephrology Clinical Practice Guideline,American Journal of Kidney Diseases,2013,10.1053/j.ajkd.2013.03.028,https://experts.mcmaster.ca/display/publication711803,2025-07-27T15:11:20.205623
Reem Adel Mustafa,mustafr@mcmaster.ca,journal_articles,Educational games for health professionals,Cochrane Database of Systematic Reviews,2013,10.1002/14651858.cd006411.pub4,https://experts.mcmaster.ca/display/publication626880,2025-07-27T15:11:20.205624
Reem Adel Mustafa,mustafr@mcmaster.ca,journal_articles,Addressing continuous data for participants excluded from trial analysis: a guide for systematic reviewers,Journal of Clinical Epidemiology,2013,10.1016/j.jclinepi.2013.03.014,https://experts.mcmaster.ca/display/publication174940,2025-07-27T15:11:20.205625
Reem Adel Mustafa,mustafr@mcmaster.ca,journal_articles,Antivirals for influenza: a summary of a systematic review and meta-analysis of observational studies,Influenza and other Respiratory Viruses,2013,10.1111/irv.12085,https://experts.mcmaster.ca/display/publication970139,2025-07-27T15:11:20.205626
Reem Adel Mustafa,mustafr@mcmaster.ca,journal_articles,The GRADE approach is reproducible in assessing the quality of evidence of quantitative evidence syntheses,Journal of Clinical Epidemiology,2013,10.1016/j.jclinepi.2013.02.004,https://experts.mcmaster.ca/display/publication826476,2025-07-27T15:11:20.205627
Reem Adel Mustafa,mustafr@mcmaster.ca,journal_articles,A Comprehensive Review of Hypertension in Pregnancy,Journal of Pregnancy,2012,10.1155/2012/105918,https://experts.mcmaster.ca/display/publication1531974,2025-07-27T15:11:20.205628
Reem Adel Mustafa,mustafr@mcmaster.ca,journal_articles,Antivirals for treatment of influenza: a systematic review and meta-analysis of observational studies,ACP journal club,2012,10.7326/0003-4819-156-7-201204030-00411,https://experts.mcmaster.ca/display/publication970148,2025-07-27T15:11:20.205629
Reem Adel Mustafa,mustafr@mcmaster.ca,journal_articles,Biofeedback dialysis for hypotension and hypervolemia: a systematic review and meta-analysis,Nephrology Dialysis Transplantation,2012,10.1093/ndt/gfs389,https://experts.mcmaster.ca/display/publication826475,2025-07-27T15:11:20.205630
Reem Adel Mustafa,mustafr@mcmaster.ca,journal_articles,Diagnostik und linked evidence – Wie robust muss die Kette sein?,"Zeitschrift für Evidenz, Fortbildung und Qualitat im Gesundheitswesen",2012,10.1016/j.zefq.2012.04.001,https://experts.mcmaster.ca/display/publication1122226,2025-07-27T15:11:20.205631
Reem Adel Mustafa,mustafr@mcmaster.ca,journal_articles,Effects of higher-versus lower-protein diets on health outcomes: a systematic review and meta-analysis,European Journal of Clinical Nutrition,2012,10.1038/ejcn.2012.37,https://experts.mcmaster.ca/display/publication807612,2025-07-27T15:11:20.205632
Reem Adel Mustafa,mustafr@mcmaster.ca,journal_articles,"In hemodialysis patients with CHF, adding telmisartan to standard ACE inhibitors reduced CHD mortality and admissions",ACP journal club,2011,10.7326/0003-4819-154-10-201105170-02005,https://experts.mcmaster.ca/display/publication1545505,2025-07-27T15:11:20.205633
Reem Adel Mustafa,mustafr@mcmaster.ca,journal_articles,Use of anti‐CD20 antibody in the treatment of post‐transplant glomerulonephritis,Clinical Transplantation,2011,10.1111/j.1399-0012.2010.01245.x,https://experts.mcmaster.ca/display/publication1531973,2025-07-27T15:11:20.205634
Reem Adel Mustafa,mustafr@mcmaster.ca,journal_articles,The effects of tracking responses and the day of mailing on physician survey response rate: three randomized trials,PLoS ONE,2011,10.1371/journal.pone.0016942,https://experts.mcmaster.ca/display/publication1520767,2025-07-27T15:11:20.205635
Reem Adel Mustafa,mustafr@mcmaster.ca,journal_articles,Support for and aspects of use of educational games in family medicine and internal medicine residency programs in the US: a survey,BMC Medical Education,2010,10.1186/1472-6920-10-26,https://experts.mcmaster.ca/display/publication1520772,2025-07-27T15:11:20.205636
Reem Adel Mustafa,mustafr@mcmaster.ca,journal_articles,Curricula for teaching the content of clinical practice guidelines to family medicine and internal medicine residents in the US: a survey study,Implementation Science,2009,10.1186/1748-5908-4-59,https://experts.mcmaster.ca/display/publication1520568,2025-07-27T15:11:20.205637
Reem Adel Mustafa,mustafr@mcmaster.ca,journal_articles,Educational games for health professionals,Clinical Respiratory Journal,2008,10.1002/14651858.cd006411.pub2,https://experts.mcmaster.ca/display/publication1190563,2025-07-27T15:11:20.205638
