faculty_name,faculty_email,publication_type,title,journal,year,doi,url,file_created
Salim Yusuf,yusuf@mcmaster.ca,journal_articles,Sensible guidelines for the conduct of large randomized trials,Clinical Trials,2008,10.1177/1740774507088099,https://experts.mcmaster.ca/display/publication443869,2025-07-27T15:15:21.177545
Salim Yusuf,yusuf@mcmaster.ca,journal_articles,Specific barriers to the conduct of randomized trials,Clinical Trials,2008,10.1177/1740774507087704,https://experts.mcmaster.ca/display/publication910649,2025-07-27T15:15:21.177546
Salim Yusuf,yusuf@mcmaster.ca,journal_articles,The role of fondaparinux as an adjunct to thrombolytic therapy in acute myocardial infarction: a subgroup analysis of the OASIS-6 trial,European Heart Journal,2008,10.1093/eurheartj/ehm616,https://experts.mcmaster.ca/display/publication910650,2025-07-27T15:15:21.177547
Salim Yusuf,yusuf@mcmaster.ca,journal_articles,Correction of Population Stratification in Large Multi-Ethnic Association Studies,PLoS ONE,2008,10.1371/journal.pone.0001382,https://experts.mcmaster.ca/display/publication193059,2025-07-27T15:15:21.177548
Salim Yusuf,yusuf@mcmaster.ca,journal_articles,Development of food frequency questionnaires and a nutrient database for the Prospective Urban and Rural Epidemiological (PURE) pilot study in South India: methodological issues.,Asia Pacific Journal of Clinical Nutrition,2008,,https://experts.mcmaster.ca/display/publication910647,2025-07-27T15:15:21.177549
Salim Yusuf,yusuf@mcmaster.ca,journal_articles,Efficacy of cholesterol-lowering therapy in 18 686 people with diabetes in 14 randomised trials of statins: a meta-analysis,The Lancet,2008,10.1016/s0140-6736(08)60104-x,https://experts.mcmaster.ca/display/publication3399426,2025-07-27T15:15:21.177550
Salim Yusuf,yusuf@mcmaster.ca,journal_articles,Epidemiology and causation of coronary heart disease and stroke in India,Heart,2008,10.1136/hrt.2007.132951,https://experts.mcmaster.ca/display/publication910653,2025-07-27T15:15:21.177551
Salim Yusuf,yusuf@mcmaster.ca,journal_articles,"Interrelation of saturated fat, trans fat, alcohol intake, and subclinical atherosclerosis",American Journal of Clinical Nutrition,2008,10.1093/ajcn/87.1.168,https://experts.mcmaster.ca/display/publication210336,2025-07-27T15:15:21.177552
Salim Yusuf,yusuf@mcmaster.ca,journal_articles,Polypharmacotherapy for primary prevention of cardiovascular disease.,Indian Heart Journal,2008,,https://experts.mcmaster.ca/display/publication910617,2025-07-27T15:15:21.177553
Salim Yusuf,yusuf@mcmaster.ca,journal_articles,"Rationale, design, and baseline characteristics for a large international trial of cardiovascular disease prevention in people with dysglycemia: The ORIGIN Trial (Outcome Reduction with an Initial Glargine Intervention)",American Heart Journal,2008,10.1016/j.ahj.2007.09.009,https://experts.mcmaster.ca/display/publication910654,2025-07-27T15:15:21.177554
Salim Yusuf,yusuf@mcmaster.ca,journal_articles,Association between the -455T>C promoter polymorphism of the APOC3gene and the metabolic syndrome in a multi-ethnic sample,BMC Medical Genetics,2007,10.1186/1471-2350-8-80,https://experts.mcmaster.ca/display/publication210339,2025-07-27T15:15:21.177555
Salim Yusuf,yusuf@mcmaster.ca,journal_articles,Does treatment with rosiglitazone increase cardiovascular risk of patients with type 2 diabetes mellitus?,Nature Reviews Endocrinology,2007,10.1038/ncpendmet0640,https://experts.mcmaster.ca/display/publication886382,2025-07-27T15:15:21.177556
Salim Yusuf,yusuf@mcmaster.ca,journal_articles,Glucose-Insulin-Potassium Therapy in Patients With ST-Segment Elevation Myocardial Infarction,Journal of the American Medical Association (JAMA),2007,10.1001/jama.298.20.2399,https://experts.mcmaster.ca/display/publication910655,2025-07-27T15:15:21.177557
Salim Yusuf,yusuf@mcmaster.ca,journal_articles,A Family-based Intervention to Promote Healthy Lifestyles in an Aboriginal Community in Canada,Canadian Journal of Public Health,2007,10.1007/bf03405436,https://experts.mcmaster.ca/display/publication210330,2025-07-27T15:15:21.177558
Salim Yusuf,yusuf@mcmaster.ca,journal_articles,Incidence and Predictors of Hyperkalemia in Patients With Heart Failure,Journal of the American College of Cardiology,2007,10.1016/j.jacc.2007.07.067,https://experts.mcmaster.ca/display/publication910657,2025-07-27T15:15:21.177559
Salim Yusuf,yusuf@mcmaster.ca,journal_articles,Incidence of Stroke in Paroxysmal Versus Sustained Atrial Fibrillation in Patients Taking Oral Anticoagulation or Combined Antiplatelet Therapy,Journal of the American College of Cardiology,2007,10.1016/j.jacc.2007.07.076,https://experts.mcmaster.ca/display/publication651742,2025-07-27T15:15:21.177560
Salim Yusuf,yusuf@mcmaster.ca,journal_articles,Resequencing Genomic DNA of Patients With Severe Hypertriglyceridemia (MIM 144650),"Arteriosclerosis, Thrombosis and Vascular Biology",2007,10.1161/atvbaha.107.150680,https://experts.mcmaster.ca/display/publication193065,2025-07-27T15:15:21.177561
Salim Yusuf,yusuf@mcmaster.ca,journal_articles,Venous thromboembolism in association with features of the metabolic syndrome,QJM - Monthly Journal of the Association of Physicians,2007,10.1093/qjmed/hcm083,https://experts.mcmaster.ca/display/publication848468,2025-07-27T15:15:21.177562
Salim Yusuf,yusuf@mcmaster.ca,journal_articles,Appropriate medical management and close follow-up for adherence and efficacy,New England Journal of Medicine,2007,,https://experts.mcmaster.ca/display/publication1748343,2025-07-27T15:15:21.177563
Salim Yusuf,yusuf@mcmaster.ca,journal_articles,Clinical decisions. Management of stable coronary disease.,New England Journal of Medicine,2007,10.1056/NEJMclde078169,https://experts.mcmaster.ca/display/publication910661,2025-07-27T15:15:21.177564
Salim Yusuf,yusuf@mcmaster.ca,journal_articles,Management of Stable Coronary Disease,New England Journal of Medicine,2007,10.1056/nejmclde078169,https://experts.mcmaster.ca/display/publication1389505,2025-07-27T15:15:21.177565
Salim Yusuf,yusuf@mcmaster.ca,journal_articles,Efficacy and Safety of Fondaparinux Versus Enoxaparin in Patients With Acute Coronary Syndromes Undergoing Percutaneous Coronary Intervention,Journal of the American College of Cardiology,2007,10.1016/j.jacc.2007.07.042,https://experts.mcmaster.ca/display/publication910659,2025-07-27T15:15:21.177566
Salim Yusuf,yusuf@mcmaster.ca,journal_articles,Global burden of cardiovascular disease,Heart,2007,10.1136/hrt.2007.131060,https://experts.mcmaster.ca/display/publication910665,2025-07-27T15:15:21.177567
Salim Yusuf,yusuf@mcmaster.ca,journal_articles,"Infarct size, ejection fraction, and mortality in diabetic patients with acute myocardial infarction treated with thrombolytic therapy",American Heart Journal,2007,10.1016/j.ahj.2007.06.020,https://experts.mcmaster.ca/display/publication910663,2025-07-27T15:15:21.177568
Salim Yusuf,yusuf@mcmaster.ca,journal_articles,Influence of Nonfatal Hospitalization for Heart Failure on Subsequent Mortality in Patients With Chronic Heart Failure,Circulation,2007,10.1161/circulationaha.107.696906,https://experts.mcmaster.ca/display/publication910671,2025-07-27T15:15:21.177569
Salim Yusuf,yusuf@mcmaster.ca,journal_articles,Influence of Renal Function on the Efficacy and Safety of Fondaparinux Relative to Enoxaparin in Non–ST-Segment Elevation Acute Coronary Syndromes,ACP journal club,2007,10.7326/0003-4819-147-5-200709040-00005,https://experts.mcmaster.ca/display/publication910669,2025-07-27T15:15:21.177570
Salim Yusuf,yusuf@mcmaster.ca,journal_articles,Coronary artery disease - Impact of ramipril on the incidence of atrial fibrillation: Results of the Heart Outcomes Prevention Evaluation study,American Heart Journal,2007,10.1016/j.ahj.2007.04.062,https://experts.mcmaster.ca/display/publication746493,2025-07-27T15:15:21.177571
Salim Yusuf,yusuf@mcmaster.ca,journal_articles,Impact of ramipril on the incidence of atrial fibrillation: Results of the Heart Outcomes Prevention Evaluation study,American Heart Journal,2007,10.1016/j.ahj.2007.04.062,https://experts.mcmaster.ca/display/publication910276,2025-07-27T15:15:21.177572
Salim Yusuf,yusuf@mcmaster.ca,journal_articles,The Editor's Roundtable: Arterial Thrombosis and Acute Coronary Syndromes,American Journal of Cardiology,2007,10.1016/j.amjcard.2007.05.025,https://experts.mcmaster.ca/display/publication910667,2025-07-27T15:15:21.177573
Salim Yusuf,yusuf@mcmaster.ca,journal_articles,Body Mass Index and Prognosis in Patients With Chronic Heart Failure,Circulation,2007,10.1161/circulationaha.106.679779,https://experts.mcmaster.ca/display/publication910675,2025-07-27T15:15:21.177574
Salim Yusuf,yusuf@mcmaster.ca,journal_articles,Challenges of Establishing New Antithrombotic Therapies in Atrial Fibrillation,Circulation,2007,10.1161/circulationaha.107.695163,https://experts.mcmaster.ca/display/publication180538,2025-07-27T15:15:21.177575
Salim Yusuf,yusuf@mcmaster.ca,journal_articles,Oral Anticoagulant and Antiplatelet Therapy and Peripheral Arterial Disease,New England Journal of Medicine,2007,10.1056/nejmoa065959,https://experts.mcmaster.ca/display/publication193072,2025-07-27T15:15:21.177576
Salim Yusuf,yusuf@mcmaster.ca,journal_articles,Quantitating loss of life by smoking a single cigarette,Clinical Research in Cardiology,2007,10.1007/s00392-007-0523-y,https://experts.mcmaster.ca/display/publication910685,2025-07-27T15:15:21.177577
Salim Yusuf,yusuf@mcmaster.ca,journal_articles,Red Cell Distribution Width as a Novel Prognostic Marker in Heart Failure,Journal of the American College of Cardiology,2007,10.1016/j.jacc.2007.02.067,https://experts.mcmaster.ca/display/publication910677,2025-07-27T15:15:21.177578
Salim Yusuf,yusuf@mcmaster.ca,journal_articles,"Sexual function, satisfaction, and association of erectile dysfunction with cardiovascular disease and risk factors in cardiovascular high-risk patients: Substudy of the ONgoing Telmisartan Alone and in Combination with Ramipril Global Endpoint Trial/Telmisartan Randomized AssessmeNT Study in ACE-INtolerant Subjects with Cardiovascular Disease (ONTARGET/TRANSCEND)",American Heart Journal,2007,10.1016/j.ahj.2007.03.024,https://experts.mcmaster.ca/display/publication910679,2025-07-27T15:15:21.177579
Salim Yusuf,yusuf@mcmaster.ca,journal_articles,Sex Differences in Clinical Characteristics and Prognosis in a Broad Spectrum of Patients With Heart Failure,Circulation,2007,10.1161/circulationaha.106.673442,https://experts.mcmaster.ca/display/publication910683,2025-07-27T15:15:21.177580
Salim Yusuf,yusuf@mcmaster.ca,journal_articles,Acute coronary syndromes without ST segment elevation,The BMJ,2007,10.1136/bmj.39220.618646.ae,https://experts.mcmaster.ca/display/publication910681,2025-07-27T15:15:21.177581
Salim Yusuf,yusuf@mcmaster.ca,journal_articles,Action to Control Cardiovascular Risk in Diabetes (ACCORD) Trial: Design and Methods,American Journal of Cardiology,2007,10.1016/j.amjcard.2007.03.003,https://experts.mcmaster.ca/display/publication886390,2025-07-27T15:15:21.177582
Salim Yusuf,yusuf@mcmaster.ca,journal_articles,Capacity planning for cardiac catheterization: A case study,Health Policy,2007,10.1016/j.healthpol.2006.07.010,https://experts.mcmaster.ca/display/publication910709,2025-07-27T15:15:21.177583
Salim Yusuf,yusuf@mcmaster.ca,journal_articles,Effect of long-term ACE-inhibitor therapy in elderly vascular disease patients,European Heart Journal,2007,10.1093/eurheartj/ehm017,https://experts.mcmaster.ca/display/publication910279,2025-07-27T15:15:21.177584
Salim Yusuf,yusuf@mcmaster.ca,journal_articles,Monitoring the randomized trials of the Women's Health Initiative: the experience of the Data and Safety Monitoring Board,Clinical Trials,2007,10.1177/1740774507079439,https://experts.mcmaster.ca/display/publication646913,2025-07-27T15:15:21.177585
Salim Yusuf,yusuf@mcmaster.ca,journal_articles,"Response to Letter Regarding Article, “The Inflammatory Hypothesis: Any Progress in Risk Stratification and Therapeutic Targets?”",Circulation,2007,10.1161/circulationaha.106.684464,https://experts.mcmaster.ca/display/publication1389513,2025-07-27T15:15:21.177587
Salim Yusuf,yusuf@mcmaster.ca,journal_articles,Risk Factors for Early Myocardial Infarction in South Asians—Reply,Journal of the American Medical Association (JAMA),2007,10.1001/jama.297.17.1881-a,https://experts.mcmaster.ca/display/publication1389518,2025-07-27T15:15:21.177589
Salim Yusuf,yusuf@mcmaster.ca,journal_articles,Blood pressure-dependent and independent effects of agents that inhibit the renin–angiotensin system,Journal of Hypertension,2007,10.1097/hjh.0b013e3280bad9b4,https://experts.mcmaster.ca/display/publication543014,2025-07-27T15:15:21.177590
Salim Yusuf,yusuf@mcmaster.ca,journal_articles,Prevalence and prognostic impact of bundle branch block in patients with heart failure: Evidence from the CHARM programme,EUROPEAN JOURNAL OF HEART FAILURE,2007,10.1016/j.ejheart.2006.11.006,https://experts.mcmaster.ca/display/publication910697,2025-07-27T15:15:21.177591
Salim Yusuf,yusuf@mcmaster.ca,journal_articles,Risk of hospitalization during influenza season among a cohort of patients with congestive heart failure,Epidemiology and Infection,2007,10.1017/s095026880600714x,https://experts.mcmaster.ca/display/publication128146,2025-07-27T15:15:21.177592
Salim Yusuf,yusuf@mcmaster.ca,journal_articles,Risk of hospitalization during influenza season among a cohort of patients with congestive heart failure,Epidemiology and Infection,2007,10.1017/S095026880600714X,https://experts.mcmaster.ca/display/publication161831,2025-07-27T15:15:21.177593
Salim Yusuf,yusuf@mcmaster.ca,journal_articles,Stroke and Cardiovascular Diseases: The Need for a Global Approach for Prevention and Drug Development,International Journal of Stroke,2007,10.1111/j.1747-4949.2007.00118.x,https://experts.mcmaster.ca/display/publication910643,2025-07-27T15:15:21.177601
Salim Yusuf,yusuf@mcmaster.ca,journal_articles,Defining Obesity Cut Points in a Multiethnic Population,Circulation,2007,10.1161/circulationaha.106.635011,https://experts.mcmaster.ca/display/publication210346,2025-07-27T15:15:21.177608
Salim Yusuf,yusuf@mcmaster.ca,journal_articles,Renal function and outcomes in acute coronary syndrome: impact of clopidogrel,European Journal of Preventive Cardiology (EJPC),2007,10.1097/01.hjr.0000220582.19516.a6,https://experts.mcmaster.ca/display/publication910687,2025-07-27T15:15:21.177611
Salim Yusuf,yusuf@mcmaster.ca,journal_articles,Glucose Levels Predict Hospitalization for Congestive Heart Failure in Patients at High Cardiovascular Risk,Circulation,2007,10.1161/circulationaha.106.661405,https://experts.mcmaster.ca/display/publication378234,2025-07-27T15:15:21.177614
Salim Yusuf,yusuf@mcmaster.ca,journal_articles,Risk Factors for Acute Myocardial Infarction in Latin America,Circulation,2007,10.1161/circulationaha.106.633552,https://experts.mcmaster.ca/display/publication910693,2025-07-27T15:15:21.177617
Salim Yusuf,yusuf@mcmaster.ca,journal_articles,Effect of ramipril on the incidence of diabetes - Reply,New England Journal of Medicine,2007,,https://experts.mcmaster.ca/display/publication1389536,2025-07-27T15:15:21.177620
Salim Yusuf,yusuf@mcmaster.ca,journal_articles,The authors reply [6],New England Journal of Medicine,2007,,https://experts.mcmaster.ca/display/publication1746250,2025-07-27T15:15:21.177622
Salim Yusuf,yusuf@mcmaster.ca,journal_articles,Risk Factors for Early Myocardial Infarction in South Asians Compared With Individuals in Other Countries,Journal of the American Medical Association (JAMA),2007,10.1001/jama.297.3.286,https://experts.mcmaster.ca/display/publication910699,2025-07-27T15:15:21.177625
Salim Yusuf,yusuf@mcmaster.ca,journal_articles,Carbohydrate intake and HDL in a multiethnic population,American Journal of Clinical Nutrition,2007,10.1093/ajcn/85.1.225,https://experts.mcmaster.ca/display/publication210350,2025-07-27T15:15:21.177628
Salim Yusuf,yusuf@mcmaster.ca,journal_articles,Characterization of health‐related quality of life in heart failure patients with preserved versus low ejection fraction in CHARM,EUROPEAN JOURNAL OF HEART FAILURE,2007,10.1016/j.ejheart.2006.10.012,https://experts.mcmaster.ca/display/publication910703,2025-07-27T15:15:21.177631
Salim Yusuf,yusuf@mcmaster.ca,journal_articles,Monitoring the randomized trials of the Women's Health Initiative the experience of the data and safety monitoring board,Clinical Trials,2007,10.1177/1740774507079439,https://experts.mcmaster.ca/display/publication1217324,2025-07-27T15:15:21.177634
Salim Yusuf,yusuf@mcmaster.ca,journal_articles,Prevalence and prognostic implications of electrocardiographic left ventricular hypertrophy in heart failure: evidence from the CHARM programme,Heart,2007,10.1136/hrt.2005.083949,https://experts.mcmaster.ca/display/publication910710,2025-07-27T15:15:21.177636
Salim Yusuf,yusuf@mcmaster.ca,journal_articles,Prevalence of traditional cardiovascular risk factors among Nigerians with stroke.,SAMJ - South African Medical Journal,2007,,https://experts.mcmaster.ca/display/publication141025,2025-07-27T15:15:21.177639
Salim Yusuf,yusuf@mcmaster.ca,journal_articles,Prevention of vascular events in atrial fibrillation – Authors' reply,The Lancet,2007,10.1016/s0140-6736(07)60069-5,https://experts.mcmaster.ca/display/publication1389534,2025-07-27T15:15:21.177642
Salim Yusuf,yusuf@mcmaster.ca,journal_articles,"Rationale, Design and Baseline Data of a Randomized, Double-Blind, Controlled Trial Comparing Two Antithrombotic Regimens (a Fixed-Dose Combination of Extended-Release Dipyridamole plus ASA with Clopidogrel) and Telmisartan versus Placebo in Patients with Strokes: The Prevention Regimen for Effectively Avoiding Second Strokes Trial (PRoFESS)",Cerebrovascular Diseases,2007,10.1159/000100105,https://experts.mcmaster.ca/display/publication910695,2025-07-27T15:15:21.177644
Salim Yusuf,yusuf@mcmaster.ca,journal_articles,Rosiglitazone delays the development of diabetes mellitus (DREAM trial),Cleveland Clinic Journal of Medicine,2007,,https://experts.mcmaster.ca/display/publication1375836,2025-07-27T15:15:21.177647
Salim Yusuf,yusuf@mcmaster.ca,journal_articles,Independent design and conduct of clinical trials,Clinical Trials,2006,10.1177/1740774506073463,https://experts.mcmaster.ca/display/publication910705,2025-07-27T15:15:21.177650
Salim Yusuf,yusuf@mcmaster.ca,journal_articles,Reevaluation by High-Performance Liquid Chromatography: Clinical Significance of Microalbuminuria in Individuals at High Risk of Cardiovascular Disease in the Heart Outcomes Prevention Evaluation (HOPE) Study,American Journal of Kidney Diseases,2006,10.1053/j.ajkd.2006.09.003,https://experts.mcmaster.ca/display/publication848470,2025-07-27T15:15:21.177653
Salim Yusuf,yusuf@mcmaster.ca,journal_articles,Reply,Journal of the American College of Cardiology,2006,10.1016/j.jacc.2006.08.021,https://experts.mcmaster.ca/display/publication200374,2025-07-27T15:15:21.177656
Salim Yusuf,yusuf@mcmaster.ca,journal_articles,The DREAM trial – Authors' reply,The Lancet,2006,10.1016/s0140-6736(06)69829-2,https://experts.mcmaster.ca/display/publication1375835,2025-07-27T15:15:21.177659
Salim Yusuf,yusuf@mcmaster.ca,journal_articles,Fondaparinux in Patients With ST-Segment Elevation Myocardial Infarction—Reply,Journal of the American Medical Association (JAMA),2006,10.1001/jama.296.17.2088-b,https://experts.mcmaster.ca/display/publication1389546,2025-07-27T15:15:21.177661
Salim Yusuf,yusuf@mcmaster.ca,journal_articles,In reply [4],Journal of the American Medical Association (JAMA),2006,,https://experts.mcmaster.ca/display/publication1748350,2025-07-27T15:15:21.177664
Salim Yusuf,yusuf@mcmaster.ca,journal_articles,Effect of Ramipril on the Incidence of Diabetes,New England Journal of Medicine,2006,10.1056/nejmoa065061,https://experts.mcmaster.ca/display/publication886397,2025-07-27T15:15:21.177666
Salim Yusuf,yusuf@mcmaster.ca,journal_articles,The Inflammatory Hypothesis,Circulation,2006,10.1161/circulationaha.106.652081,https://experts.mcmaster.ca/display/publication910707,2025-07-27T15:15:21.177669
Salim Yusuf,yusuf@mcmaster.ca,journal_articles,"Social disadvantage and cardiovascular disease: development of an index and analysis of age, sex, and ethnicity effects",International Journal of Epidemiology,2006,10.1093/ije/dyl163,https://experts.mcmaster.ca/display/publication210352,2025-07-27T15:15:21.177672
Salim Yusuf,yusuf@mcmaster.ca,journal_articles,Unmasking of the Brugada Syndrome Phenotype During the Acute Phase of Amiodarone Infusion,Circulation,2006,10.1161/circulationaha.106.620799,https://experts.mcmaster.ca/display/publication910708,2025-07-27T15:15:21.177674
Salim Yusuf,yusuf@mcmaster.ca,journal_articles,Effect of rosiglitazone on the frequency of diabetes in patients with impaired glucose tolerance or impaired fasting glucose: a randomised controlled trial,The Lancet,2006,10.1016/s0140-6736(06)69420-8,https://experts.mcmaster.ca/display/publication55102,2025-07-27T15:15:21.177677
Salim Yusuf,yusuf@mcmaster.ca,journal_articles,Impact of Ramipril on the Circadian Periodicity of Acute Myocardial Infarction,American Journal of Cardiology,2006,10.1016/j.amjcard.2006.03.061,https://experts.mcmaster.ca/display/publication910711,2025-07-27T15:15:21.177680
Salim Yusuf,yusuf@mcmaster.ca,journal_articles,Should angiotensin-converting enzyme-inhibitors be used to improve outcome in patients with coronary artery disease and 'preserved' left ventricular function?,European Heart Journal,2006,10.1093/eurheartj/ehl122,https://experts.mcmaster.ca/display/publication910713,2025-07-27T15:15:21.177683
Salim Yusuf,yusuf@mcmaster.ca,journal_articles,The burden of cardiovascular disease in the Indian subcontinent.,Indian Journal of Medical Research,2006,,https://experts.mcmaster.ca/display/publication910706,2025-07-27T15:15:21.177685
Salim Yusuf,yusuf@mcmaster.ca,journal_articles,Adverse Impact of Bleeding on Prognosis in Patients With Acute Coronary Syndromes,Circulation,2006,10.1161/circulationaha.106.612812,https://experts.mcmaster.ca/display/publication210353,2025-07-27T15:15:21.177688
Salim Yusuf,yusuf@mcmaster.ca,journal_articles,Adverse impact of bleeding on prognosis in patients with acute coronary syndromes,Circulation,2006,10.1161/CIRCULATIONAHA.106.612812,https://experts.mcmaster.ca/display/publication212332,2025-07-27T15:15:21.177691
Salim Yusuf,yusuf@mcmaster.ca,journal_articles,Angiotensin-converting-enzyme inhibitors in stable vascular disease without left ventricular systolic dysfunction or heart failure: a combined analysis of three trials,The Lancet,2006,10.1016/s0140-6736(06)69201-5,https://experts.mcmaster.ca/display/publication910714,2025-07-27T15:15:21.177693
Salim Yusuf,yusuf@mcmaster.ca,journal_articles,"Rationale, design, and organization of the PeriOperative ISchemic Evaluation (POISE) Trial: A randomized controlled trial of metoprolol versus placebo in patients undergoing noncardiac surgery",American Heart Journal,2006,10.1016/j.ahj.2006.05.019,https://experts.mcmaster.ca/display/publication587562,2025-07-27T15:15:21.177696
Salim Yusuf,yusuf@mcmaster.ca,journal_articles,Tobacco use and risk of myocardial infarction in 52 countries in the INTERHEART study: a case-control study,The Lancet,2006,10.1016/s0140-6736(06)69249-0,https://experts.mcmaster.ca/display/publication910712,2025-07-27T15:15:21.177699
Salim Yusuf,yusuf@mcmaster.ca,journal_articles,Comparative Impact of Multiple Biomarkers and N-Terminal Pro-Brain Natriuretic Peptide in the Context of Conventional Risk Factors for the Prediction of Recurrent Cardiovascular Events in the Heart Outcomes Prevention Evaluation (HOPE) Study,Circulation,2006,10.1161/circulationaha.105.590927,https://experts.mcmaster.ca/display/publication128149,2025-07-27T15:15:21.177702
Salim Yusuf,yusuf@mcmaster.ca,journal_articles,Cardiovascular Outcomes With Atrial-Based Pacing Compared With Ventricular Pacing,Circulation,2006,10.1161/circulationaha.105.610303,https://experts.mcmaster.ca/display/publication651759,2025-07-27T15:15:21.177705
Salim Yusuf,yusuf@mcmaster.ca,journal_articles,A cardiologist's guide to waist management,Heart,2006,10.1136/hrt.2005.080945,https://experts.mcmaster.ca/display/publication910716,2025-07-27T15:15:21.177707
Salim Yusuf,yusuf@mcmaster.ca,journal_articles,Prevention of atrial fibrillation in patients with symptomatic chronic heart failure by candesartan in the Candesartan in Heart failure: Assessment of Reduction in Mortality and morbidity (CHARM) program,American Heart Journal,2006,10.1016/j.ahj.2005.06.036,https://experts.mcmaster.ca/display/publication910715,2025-07-27T15:15:21.177710
Salim Yusuf,yusuf@mcmaster.ca,journal_articles,The decline of academic medicine,The Lancet,2006,10.1016/s0140-6736(06)69068-5,https://experts.mcmaster.ca/display/publication1389543,2025-07-27T15:15:21.177713
Salim Yusuf,yusuf@mcmaster.ca,journal_articles,Enoxaparin versus Unfractionated Heparin in ST-Elevation Myocardial Infarction,New England Journal of Medicine,2006,10.1056/nejmc061197,https://experts.mcmaster.ca/display/publication1520698,2025-07-27T15:15:21.177716
Salim Yusuf,yusuf@mcmaster.ca,journal_articles,Fondaparinux versus enoxaparin in acute coronary syndromes - Reply,New England Journal of Medicine,2006,,https://experts.mcmaster.ca/display/publication1389548,2025-07-27T15:15:21.177719
Salim Yusuf,yusuf@mcmaster.ca,journal_articles,Clopidogrel plus aspirin versus oral anticoagulation for atrial fibrillation in the Atrial fibrillation Clopidogrel Trial with Irbesartan for prevention of Vascular Events (ACTIVE W): a randomised controlled trial,The Lancet,2006,10.1016/s0140-6736(06)68845-4,https://experts.mcmaster.ca/display/publication910717,2025-07-27T15:15:21.177721
