faculty_name,faculty_email,publication_type,title,journal,year,doi,url,file_created
Salim Yusuf,yusuf@mcmaster.ca,journal_articles,Patterns of Medication Use in Patients With Heart Failure,Southern Medical Journal,1995,10.1097/00007611-199505000-00002,https://experts.mcmaster.ca/display/publication910976,2025-07-27T15:15:21.185543
Salim Yusuf,yusuf@mcmaster.ca,journal_articles,COST-EFFECTIVENESS STUDIES - CAN BENEFIT BE SHOWN ONLY IN HIGH-RISK POPULATIONS,British Journal of Clinical Practice,1995,,https://experts.mcmaster.ca/display/publication1390037,2025-07-27T15:15:21.185544
Salim Yusuf,yusuf@mcmaster.ca,journal_articles,Magnesium in acute myocardial infarction,The BMJ,1995,10.1136/bmj.310.6982.751,https://experts.mcmaster.ca/display/publication910978,2025-07-27T15:15:21.185545
Salim Yusuf,yusuf@mcmaster.ca,journal_articles,Effects of exercise training in patients with congestive heart failure: A critical review,Journal of the American College of Cardiology,1995,10.1016/0735-1097(94)00428-s,https://experts.mcmaster.ca/display/publication246401,2025-07-27T15:15:21.185546
Salim Yusuf,yusuf@mcmaster.ca,journal_articles,"ISIS-4: A randomised factorial trial assessing early oral captopril, oral mononitrate, and intravenous magnesium sulphate in 58 050 patients with suspected acute myocardial infarction",The Lancet,1995,10.1016/s0140-6736(95)90865-x,https://experts.mcmaster.ca/display/publication393081,2025-07-27T15:15:21.185547
Salim Yusuf,yusuf@mcmaster.ca,journal_articles,Neurohumoral variability in left ventricular dysfunction,American Journal of Cardiology,1995,10.1016/s0002-9149(99)80553-0,https://experts.mcmaster.ca/display/publication910980,2025-07-27T15:15:21.185548
Salim Yusuf,yusuf@mcmaster.ca,journal_articles,Does PTCA in Acute Myocardial Infarction Affect Mortality and Reinfarction Rates?,Circulation,1995,10.1161/01.cir.91.2.476,https://experts.mcmaster.ca/display/publication910982,2025-07-27T15:15:21.185549
Salim Yusuf,yusuf@mcmaster.ca,journal_articles,Issues regarding the use of heparin following streptokinase therapy,Journal of Thrombosis and Thrombolysis,1995,10.1007/bf01063155,https://experts.mcmaster.ca/display/publication910984,2025-07-27T15:15:21.185550
Salim Yusuf,yusuf@mcmaster.ca,journal_articles,Pharmacological treatment for myocardial infarction Part 2: Implications of clinical trials of other adjunctive therapies.,Indian Heart Journal,1995,,https://experts.mcmaster.ca/display/publication193272,2025-07-27T15:15:21.185551
Salim Yusuf,yusuf@mcmaster.ca,journal_articles,Pharmacological treatment for myocardial infarction. Part 1: Implications of clinical trials of thrombolytic and antithrombotic therapies,Indian Heart Journal,1995,,https://experts.mcmaster.ca/display/publication1746363,2025-07-27T15:15:21.185552
Salim Yusuf,yusuf@mcmaster.ca,journal_articles,EFFECT OF CORONARY-ARTERY BYPASS GRAFT-SURGERY ON SURVIVAL - REPLY,The Lancet,1994,,https://experts.mcmaster.ca/display/publication1390034,2025-07-27T15:15:21.185553
Salim Yusuf,yusuf@mcmaster.ca,journal_articles,Ten-year results of the randomized control trials of coronary artery bypass graft surgery: tabular data compiled by the collaborative effort of the original trial investigators. Part 2 of 2.,The Online journal of current clinical trials,1994,,https://experts.mcmaster.ca/display/publication910986,2025-07-27T15:15:21.185554
Salim Yusuf,yusuf@mcmaster.ca,journal_articles,Ten-year results of the randomized control trials of coronary artery bypass graft surgery: tabular data compiled by the collaborative effort of the original trial investigators. Part 1 of 2.,The Online journal of current clinical trials,1994,,https://experts.mcmaster.ca/display/publication910988,2025-07-27T15:15:21.185555
Salim Yusuf,yusuf@mcmaster.ca,journal_articles,Effect of coronary artery bypass graft surgery on survival,The Lancet,1994,10.1016/s0140-6736(94)90536-3,https://experts.mcmaster.ca/display/publication1748342,2025-07-27T15:15:21.185556
Salim Yusuf,yusuf@mcmaster.ca,journal_articles,Emerging role of angiotensin-converting enzyme inhibitors in cardiac and vascular protection.,Circulation,1994,10.1161/01.cir.90.4.2056,https://experts.mcmaster.ca/display/publication910990,2025-07-27T15:15:21.185557
Salim Yusuf,yusuf@mcmaster.ca,journal_articles,Effect of coronary artery bypass graft surgery on survival: overview of 10-year results from randomised trials by the Coronary Artery Bypass Graft Surgery Trialists Collaboration,The Lancet,1994,10.1016/s0140-6736(94)91963-1,https://experts.mcmaster.ca/display/publication910992,2025-07-27T15:15:21.185558
Salim Yusuf,yusuf@mcmaster.ca,journal_articles,Tolerability of enalapril initiation by patients with left ventricular dysfunction: Results of the medication challenge phase of the studies of left ventricular dysfunction,American Heart Journal,1994,10.1016/0002-8703(94)90490-1,https://experts.mcmaster.ca/display/publication910994,2025-07-27T15:15:21.185559
Salim Yusuf,yusuf@mcmaster.ca,journal_articles,GISSI-3: effects of lisinopril and transdermal glyceryl trinitrate singly and together on 6-week mortality and ventricular function after acute myocardial infarction. Gruppo Italiano per lo Studio della Sopravvivenza nell'infarto Miocardico.,The Lancet,1994,,https://experts.mcmaster.ca/display/publication1005130,2025-07-27T15:15:21.185560
Salim Yusuf,yusuf@mcmaster.ca,journal_articles,Panel discussion,European Heart Journal,1994,10.1093/eurheartj/15.suppl_b.26,https://experts.mcmaster.ca/display/publication1390039,2025-07-27T15:15:21.185561
Salim Yusuf,yusuf@mcmaster.ca,journal_articles,Role of Angiotensin Converting Enzyme Inhibitors in Patients with Left Ventricular Dysfunction and Congestive Heart Failure,European Heart Journal,1994,10.1093/eurheartj/15.suppl_b.9,https://experts.mcmaster.ca/display/publication277420,2025-07-27T15:15:21.185562
Salim Yusuf,yusuf@mcmaster.ca,journal_articles,Relation of neurohumoral activation to clinical variables and degree of ventricular dysfunction: A report from the registry of studies of left ventricular dysfunction,Journal of the American College of Cardiology,1994,10.1016/0735-1097(94)90385-9,https://experts.mcmaster.ca/display/publication1389938,2025-07-27T15:15:21.185563
Salim Yusuf,yusuf@mcmaster.ca,journal_articles,The impact of left ventricular dysfunction on outcomes with the implantable defibrillator,American Heart Journal,1994,10.1016/0002-8703(94)90104-x,https://experts.mcmaster.ca/display/publication910996,2025-07-27T15:15:21.185564
Salim Yusuf,yusuf@mcmaster.ca,journal_articles,Indications for fibrinolytic therapy in suspected acute myocardial infarction: collaborative overview of early mortality and major morbidity results from all randomised trials of more than 1000 patients,The Lancet,1994,10.1016/s0140-6736(94)91161-4,https://experts.mcmaster.ca/display/publication1389964,2025-07-27T15:15:21.185566
Salim Yusuf,yusuf@mcmaster.ca,journal_articles,"Quality of life among 5,025 patients with left ventricular dysfunction randomized between placebo and enalapril: The studies of left ventricular dysfunction",Journal of the American College of Cardiology,1994,10.1016/0735-1097(94)90426-x,https://experts.mcmaster.ca/display/publication910998,2025-07-27T15:15:21.185567
Salim Yusuf,yusuf@mcmaster.ca,journal_articles,"Collaborative overview of randomised trials of antiplatelet therapy Prevention of death, myocardial infarction, and stroke by prolonged antiplatelet therapy in various categories of patients",The BMJ,1994,10.1136/bmj.308.6921.81,https://experts.mcmaster.ca/display/publication923872,2025-07-27T15:15:21.185568
Salim Yusuf,yusuf@mcmaster.ca,journal_articles,Calcium antagonists in the treatment of ischemic heart disease,Coronary Artery Disease,1994,10.1097/00019501-199401000-00004,https://experts.mcmaster.ca/display/publication911000,2025-07-27T15:15:21.185569
Salim Yusuf,yusuf@mcmaster.ca,journal_articles,Diagnosis and management of heart failure. Canadian Cardiovascular Society.,Canadian Journal of Cardiology,1994,,https://experts.mcmaster.ca/display/publication1389487,2025-07-27T15:15:21.185570
Salim Yusuf,yusuf@mcmaster.ca,journal_articles,Panel discussion,European Heart Journal,1994,10.1093/eurheartj/15.suppl_b.26,https://experts.mcmaster.ca/display/publication1748376,2025-07-27T15:15:21.185571
Salim Yusuf,yusuf@mcmaster.ca,journal_articles,Recent Advances and Future Directions in Myocardial Infarction,Cardiology,1994,10.1159/000176431,https://experts.mcmaster.ca/display/publication911004,2025-07-27T15:15:21.185572
Salim Yusuf,yusuf@mcmaster.ca,journal_articles,Effect of Angiotensin-Converting Enzyme Inhibitors in Left Ventricular Dysfunction,Journal of Cardiovascular Pharmacology,1993,10.1097/00005344-199312002-00007,https://experts.mcmaster.ca/display/publication911030,2025-07-27T15:15:21.185573
Salim Yusuf,yusuf@mcmaster.ca,journal_articles,Maximizing benefits of therapies in acute myocardial infarction,American Journal of Cardiology,1993,10.1016/0002-9149(93)90121-r,https://experts.mcmaster.ca/display/publication911005,2025-07-27T15:15:21.185575
Salim Yusuf,yusuf@mcmaster.ca,journal_articles,Reduced mortality and morbidity with the use of angiotensin-converting enzyme inhibitors in patients with left ventricular dysfunction and congestive heart failure.,Herz,1993,,https://experts.mcmaster.ca/display/publication911006,2025-07-27T15:15:21.185576
Salim Yusuf,yusuf@mcmaster.ca,journal_articles,Critical review of the approaches to the prevention of sudden death,American Journal of Cardiology,1993,10.1016/0002-9149(93)90963-d,https://experts.mcmaster.ca/display/publication911007,2025-07-27T15:15:21.185577
Salim Yusuf,yusuf@mcmaster.ca,journal_articles,Effects of the angiotensin converting enzyme inhibitor enalapril on the long-term progression of left ventricular dilatation in patients with asymptomatic systolic dysfunction. SOLVD (Studies of Left Ventricular Dysfunction) Investigators.,Circulation,1993,10.1161/01.cir.88.5.2277,https://experts.mcmaster.ca/display/publication1389455,2025-07-27T15:15:21.185578
Salim Yusuf,yusuf@mcmaster.ca,journal_articles,PREDICTION OF MORTALITY AND MORBIDITY WITH A 6-MINUTE WALK TEST IN PATIENTS WITH LEFT-VENTRICULAR DYSFUNCTION,Journal of the American Medical Association (JAMA),1993,10.1001/jama.270.14.1702,https://experts.mcmaster.ca/display/publication1298506,2025-07-27T15:15:21.185579
Salim Yusuf,yusuf@mcmaster.ca,journal_articles,Prediction of mortality and morbidity with a 6-minute walk test in patients with left ventricular dysfunction. SOLVD Investigators,Journal of the American Medical Association (JAMA),1993,10.1001/jama.270.14.1702,https://experts.mcmaster.ca/display/publication767245,2025-07-27T15:15:21.185580
Salim Yusuf,yusuf@mcmaster.ca,journal_articles,EFFECTS OF PROPHYLACTIC ANTIARRHYTHMIC DRUG-THERAPY IN ACUTE MYOCARDIAL-INFARCTION - AN OVERVIEW OF RESULTS FROM RANDOMIZED CONTROLLED TRIALS,Journal of the American Medical Association (JAMA),1993,10.1001/jama.270.13.1589,https://experts.mcmaster.ca/display/publication1389556,2025-07-27T15:15:21.185582
Salim Yusuf,yusuf@mcmaster.ca,journal_articles,Effects of prophylactic antiarrhythmic drug therapy in acute myocardial infarction. An overview of results from randomized controlled trials,Journal of the American Medical Association (JAMA),1993,10.1001/jama.270.13.1589,https://experts.mcmaster.ca/display/publication911009,2025-07-27T15:15:21.185583
Salim Yusuf,yusuf@mcmaster.ca,journal_articles,Effects of  -blockers and calcium channel blockers in acute myocardial infarction,European Heart Journal,1993,10.1093/eurheartj/14.suppl_f.18,https://experts.mcmaster.ca/display/publication911019,2025-07-27T15:15:21.185584
Salim Yusuf,yusuf@mcmaster.ca,journal_articles,Comparative neurohormonal responses in patients with preserved and impaired left ventricular ejection fraction: Results of the studies of left ventricular dysfunctions (SOLVD) registry,Journal of the American College of Cardiology,1993,10.1016/0735-1097(93)90480-o,https://experts.mcmaster.ca/display/publication911015,2025-07-27T15:15:21.185585
Salim Yusuf,yusuf@mcmaster.ca,journal_articles,Current and ongoing randomized trials in heart failure and left ventricular dysfunction,Journal of the American College of Cardiology,1993,10.1016/0735-1097(93)90490-r,https://experts.mcmaster.ca/display/publication911017,2025-07-27T15:15:21.185586
Salim Yusuf,yusuf@mcmaster.ca,journal_articles,Discussion I,Journal of the American College of Cardiology,1993,10.1016/0735-1097(93)90457-c,https://experts.mcmaster.ca/display/publication1390044,2025-07-27T15:15:21.185587
Salim Yusuf,yusuf@mcmaster.ca,journal_articles,Discussion IX,Journal of the American College of Cardiology,1993,10.1016/0735-1097(93)90489-n,https://experts.mcmaster.ca/display/publication1390027,2025-07-27T15:15:21.185588
Salim Yusuf,yusuf@mcmaster.ca,journal_articles,Discussion V,Journal of the American College of Cardiology,1993,10.1016/0735-1097(93)90475-g,https://experts.mcmaster.ca/display/publication1390048,2025-07-27T15:15:21.185589
Salim Yusuf,yusuf@mcmaster.ca,journal_articles,Discussion VII,Journal of the American College of Cardiology,1993,10.1016/0735-1097(93)90483-h,https://experts.mcmaster.ca/display/publication1390053,2025-07-27T15:15:21.185590
Salim Yusuf,yusuf@mcmaster.ca,journal_articles,HEART-FAILURE IN THE 1990S - EVOLUTION OF A MAJOR PUBLIC-HEALTH PROBLEM IN CARDIOVASCULAR MEDICINE,Journal of the American College of Cardiology,1993,10.1016/0735-1097(93)90454-9,https://experts.mcmaster.ca/display/publication1389968,2025-07-27T15:15:21.185592
Salim Yusuf,yusuf@mcmaster.ca,journal_articles,Heart failure in the 1990s: Evolutions of a major public health problem in cardiovascular medicine,Journal of the American College of Cardiology,1993,10.1016/0735-1097(93)90454-9,https://experts.mcmaster.ca/display/publication911013,2025-07-27T15:15:21.185593
Salim Yusuf,yusuf@mcmaster.ca,journal_articles,Natural history and patterns of current practice in heart failure,Journal of the American College of Cardiology,1993,10.1016/0735-1097(93)90456-b,https://experts.mcmaster.ca/display/publication767247,2025-07-27T15:15:21.185594
Salim Yusuf,yusuf@mcmaster.ca,journal_articles,Panel discussion I: Evaluation and management of chronic heart failure,Journal of the American College of Cardiology,1993,10.1016/0735-1097(93)90492-j,https://experts.mcmaster.ca/display/publication1390041,2025-07-27T15:15:21.185595
Salim Yusuf,yusuf@mcmaster.ca,journal_articles,Role of Magnesium in Reducing Mortality in Acute Myocardial Infarction,Drugs,1993,10.2165/00003495-199346030-00002,https://experts.mcmaster.ca/display/publication911021,2025-07-27T15:15:21.185596
Salim Yusuf,yusuf@mcmaster.ca,journal_articles,Effects of long-term enalapril therapy on left ventricular diastolic properties in patients with depressed ejection fraction. SOLVD Investigators.,Circulation,1993,10.1161/01.cir.88.2.481,https://experts.mcmaster.ca/display/publication1390045,2025-07-27T15:15:21.185597
Salim Yusuf,yusuf@mcmaster.ca,journal_articles,"DESIGN, RESULTS, AND INTERPRETATION OF RANDOMIZED, CONTROLLED TRIALS IN CONGESTIVE-HEART-FAILURE AND LEFT-VENTRICULAR DYSFUNCTION",Circulation,1993,,https://experts.mcmaster.ca/display/publication1389768,2025-07-27T15:15:21.185598
Salim Yusuf,yusuf@mcmaster.ca,journal_articles,"Intravenous magnesium in acute myocardial infarction. An effective, safe, simple, and inexpensive intervention.",Circulation,1993,10.1161/01.cir.87.6.2043,https://experts.mcmaster.ca/display/publication543749,2025-07-27T15:15:21.185599
Salim Yusuf,yusuf@mcmaster.ca,journal_articles,Primary and secondary prevention of myocardial infarction and strokes,Journal of Hypertension,1993,10.1097/00004872-199306003-00013,https://experts.mcmaster.ca/display/publication910346,2025-07-27T15:15:21.185600
Salim Yusuf,yusuf@mcmaster.ca,journal_articles,CARDIAC MECHANICS DURING DEVELOPMENT OF HEART-FAILURE,Circulation,1993,,https://experts.mcmaster.ca/display/publication1390078,2025-07-27T15:15:21.185601
Salim Yusuf,yusuf@mcmaster.ca,journal_articles,Cardiac mechanics during development of heart failure. SOLVD Investigators.,Circulation,1993,,https://experts.mcmaster.ca/display/publication911026,2025-07-27T15:15:21.185602
Salim Yusuf,yusuf@mcmaster.ca,journal_articles,Clinical experience in protecting the failing heart.,Clinical Cardiology,1993,10.1002/clc.4960161407,https://experts.mcmaster.ca/display/publication911024,2025-07-27T15:15:21.185603
Salim Yusuf,yusuf@mcmaster.ca,journal_articles,A SURVEY OF MONITORING PRACTICES IN CANCER CLINICAL-TRIALS - DATA MONITORING COMMITTEES FOR SOUTHWEST ONCOLOGY GROUP CLINICAL-TRIALS - DISCUSSION,Statistics in Medicine,1993,,https://experts.mcmaster.ca/display/publication1389579,2025-07-27T15:15:21.185608
Salim Yusuf,yusuf@mcmaster.ca,journal_articles,ACE inhibitors for myocardial infarction and unstable angina,The Lancet,1993,10.1016/0140-6736(93)90604-f,https://experts.mcmaster.ca/display/publication911028,2025-07-27T15:15:21.185609
Salim Yusuf,yusuf@mcmaster.ca,journal_articles,PRACTICAL ISSUES IN DATA MONITORING OF CLINICAL-TRIALS - SUMMARY OF RESPONSES TO A QUESTIONNAIRE AT NIH - DISCUSSION,Statistics in Medicine,1993,,https://experts.mcmaster.ca/display/publication1389574,2025-07-27T15:15:21.185610
Salim Yusuf,yusuf@mcmaster.ca,journal_articles,Preface,Statistics in Medicine,1993,10.1002/sim.4780120502,https://experts.mcmaster.ca/display/publication1389876,2025-07-27T15:15:21.185611
Salim Yusuf,yusuf@mcmaster.ca,journal_articles,Coronary Artery Disease in Asian Indians: Prevalence and Risk Factors.,Asian American and Pacific Islander journal of health,1993,,https://experts.mcmaster.ca/display/publication911011,2025-07-27T15:15:21.185612
Salim Yusuf,yusuf@mcmaster.ca,journal_articles,"Design, results, and interpretation of randomized, controlled trials in congestive heart failure and left ventricular dysfunction",Circulation,1993,,https://experts.mcmaster.ca/display/publication1748341,2025-07-27T15:15:21.185613
Salim Yusuf,yusuf@mcmaster.ca,journal_articles,Discussion I,Journal of the American College of Cardiology,1993,10.1016/0735-1097(93)90457-c,https://experts.mcmaster.ca/display/publication1748417,2025-07-27T15:15:21.185614
Salim Yusuf,yusuf@mcmaster.ca,journal_articles,Discussion IX,Journal of the American College of Cardiology,1993,10.1016/0735-1097(93)90489-n,https://experts.mcmaster.ca/display/publication1748421,2025-07-27T15:15:21.185615
Salim Yusuf,yusuf@mcmaster.ca,journal_articles,Discussion V,Journal of the American College of Cardiology,1993,10.1016/0735-1097(93)90475-g,https://experts.mcmaster.ca/display/publication1748420,2025-07-27T15:15:21.185616
Salim Yusuf,yusuf@mcmaster.ca,journal_articles,Discussion VII,Journal of the American College of Cardiology,1993,10.1016/0735-1097(93)90483-h,https://experts.mcmaster.ca/display/publication1748419,2025-07-27T15:15:21.185617
Salim Yusuf,yusuf@mcmaster.ca,journal_articles,Enalapril for asymptomatic reduced left ventricular ejection fraction,Annals of Internal Medicine,1992,,https://experts.mcmaster.ca/display/publication1748335,2025-07-27T15:15:21.185618
Salim Yusuf,yusuf@mcmaster.ca,journal_articles,"Effect of amiodarone on mortality after myocardial infarction: A double-blind, placebo-controlled, pilot study",Journal of the American College of Cardiology,1992,10.1016/0735-1097(92)90357-s,https://experts.mcmaster.ca/display/publication1390022,2025-07-27T15:15:21.185619
Salim Yusuf,yusuf@mcmaster.ca,journal_articles,Effect of enalapril on myocardial infarction and unstable angina in patients with low ejection fractions,The Lancet,1992,10.1016/0140-6736(92)92889-n,https://experts.mcmaster.ca/display/publication911032,2025-07-27T15:15:21.185620
Salim Yusuf,yusuf@mcmaster.ca,journal_articles,Clinical characteristics of patients in Studies of Left Ventricular Dysfunction (SOLVD),American Journal of Cardiology,1992,10.1016/0002-9149(92)90734-g,https://experts.mcmaster.ca/display/publication1389447,2025-07-27T15:15:21.185621
Salim Yusuf,yusuf@mcmaster.ca,journal_articles,Prevalence of coronary artery disease in Asian Indians,American Journal of Cardiology,1992,10.1016/0002-9149(92)90744-j,https://experts.mcmaster.ca/display/publication911034,2025-07-27T15:15:21.185622
Salim Yusuf,yusuf@mcmaster.ca,journal_articles,Effect of Enalapril on Mortality and the Development of Heart Failure in Asymptomatic Patients with Reduced Left Ventricular Ejection Fractions,New England Journal of Medicine,1992,10.1056/nejm199209033271003,https://experts.mcmaster.ca/display/publication120026,2025-07-27T15:15:21.185623
Salim Yusuf,yusuf@mcmaster.ca,journal_articles,Report of the Conference on Low Blood Cholesterol: Mortality Associations.,Circulation,1992,10.1161/01.cir.86.3.1046,https://experts.mcmaster.ca/display/publication1389948,2025-07-27T15:15:21.185624
Salim Yusuf,yusuf@mcmaster.ca,journal_articles,Effects of the angiotensin converting enzyme inhibitor enalapril on the long-term progression of left ventricular dysfunction in patients with heart failure. SOLVD Investigators.,Circulation,1992,10.1161/01.cir.86.2.431,https://experts.mcmaster.ca/display/publication1389942,2025-07-27T15:15:21.185625
Salim Yusuf,yusuf@mcmaster.ca,journal_articles,"Studies of left ventricular dysfunction (SOLVD) registry: Rationale, design, methods and description of baseline characteristics",American Journal of Cardiology,1992,10.1016/0002-9149(92)90617-8,https://experts.mcmaster.ca/display/publication767253,2025-07-27T15:15:21.185626
Salim Yusuf,yusuf@mcmaster.ca,journal_articles,Cholesterol and total mortality: need for larger trials.,The BMJ,1992,10.1136/bmj.304.6843.1689,https://experts.mcmaster.ca/display/publication444255,2025-07-27T15:15:21.185627
Salim Yusuf,yusuf@mcmaster.ca,journal_articles,"Antioxidants in the prevention of human atherosclerosis. Summary of the proceedings of a National Heart, Lung, and Blood Institute Workshop: September 5-6, 1991, Bethesda, Maryland.",Circulation,1992,10.1161/01.cir.85.6.2337,https://experts.mcmaster.ca/display/publication1389562,2025-07-27T15:15:21.185628
Salim Yusuf,yusuf@mcmaster.ca,journal_articles,Effectiveness of preload reserve as a determinant of clinical status in patients with left ventricular systolic dysfunction,American Journal of Cardiology,1992,10.1016/0002-9149(92)90709-8,https://experts.mcmaster.ca/display/publication1390004,2025-07-27T15:15:21.185629
Salim Yusuf,yusuf@mcmaster.ca,journal_articles,Need for a large randomized trial to evaluate the effects of digitalis on morbidity and mortality in congestive heart failure,American Journal of Cardiology,1992,10.1016/0002-9149(92)91255-3,https://experts.mcmaster.ca/display/publication911037,2025-07-27T15:15:21.185630
Salim Yusuf,yusuf@mcmaster.ca,journal_articles,The effect of treatment on survival in congestive heart failure,Clinical Cardiology,1992,10.1002/clc.4960150504,https://experts.mcmaster.ca/display/publication911039,2025-07-27T15:15:21.185631
Salim Yusuf,yusuf@mcmaster.ca,journal_articles,Evaluation of the implantable cardioverter defibrillator in survivors of cardiac arrest: The need for randomized trials,American Journal of Cardiology,1992,10.1016/0002-9149(92)90801-5,https://experts.mcmaster.ca/display/publication871441,2025-07-27T15:15:21.185632
Salim Yusuf,yusuf@mcmaster.ca,journal_articles,ISIS-3: a randomised comparison of streptokinase vs tissue plasminogen activator vs anistreplase and of aspirin plus heparin vs aspirin alone among 41 299 cases of suspected acute myocardial infarction,The Lancet,1992,10.1016/0140-6736(92)91893-d,https://experts.mcmaster.ca/display/publication666384,2025-07-27T15:15:21.185633
Salim Yusuf,yusuf@mcmaster.ca,journal_articles,Preserved left ventricular function during supine exercise in patients after orthotopic cardiac transplantation,European Heart Journal,1992,10.1093/oxfordjournals.eurheartj.a060170,https://experts.mcmaster.ca/display/publication911041,2025-07-27T15:15:21.185634
Salim Yusuf,yusuf@mcmaster.ca,journal_articles,Reply,American Journal of Cardiology,1992,10.1016/0002-9149(92)90528-7,https://experts.mcmaster.ca/display/publication1390069,2025-07-27T15:15:21.185635
Salim Yusuf,yusuf@mcmaster.ca,journal_articles,Enalapril may prevent cardiovascular failure,American Family Physician,1992,,https://experts.mcmaster.ca/display/publication1748413,2025-07-27T15:15:21.185636
Salim Yusuf,yusuf@mcmaster.ca,journal_articles,Effects of intravenous magnesium in suspected acute myocardial infarction: overview of randomised trials.,The BMJ,1991,10.1136/bmj.303.6816.1499,https://experts.mcmaster.ca/display/publication444256,2025-07-27T15:15:21.185637
Salim Yusuf,yusuf@mcmaster.ca,journal_articles,Analyses by the Intention‐to‐Treat Principle in Randomized Trials and Databases,PACE - Pacing and Clinical Electrophysiology,1991,10.1111/j.1540-8159.1991.tb06476.x,https://experts.mcmaster.ca/display/publication911043,2025-07-27T15:15:21.185638
Salim Yusuf,yusuf@mcmaster.ca,journal_articles,Effect of enalapril on survival in patients with reduced left ventricular ejection fractions and congestive heart failure,Annals of Internal Medicine,1991,,https://experts.mcmaster.ca/display/publication1748388,2025-07-27T15:15:21.185639
Salim Yusuf,yusuf@mcmaster.ca,journal_articles,Are we biased in our approach to treating elderly patients with heart disease?,American Journal of Cardiology,1991,10.1016/0002-9149(91)90416-i,https://experts.mcmaster.ca/display/publication911045,2025-07-27T15:15:21.185640
Salim Yusuf,yusuf@mcmaster.ca,journal_articles,Implantable Cardioverter Defibrillators in Cardiovascular Practice: Report of the Policy Conference of the North American Society of Pacing and Electrophysiology,Journal of Interventional Cardiology,1991,10.1111/j.1540-8183.1991.tb00795.x,https://experts.mcmaster.ca/display/publication1748401,2025-07-27T15:15:21.185641
