faculty_name,faculty_email,publication_type,title,journal,year,doi,url,file_created
Salim Yusuf,yusuf@mcmaster.ca,journal_articles,Prognostic value of grip strength: findings from the Prospective Urban Rural Epidemiology (PURE) study,The Lancet,2015,10.1016/s0140-6736(14)62000-6,https://experts.mcmaster.ca/display/publication910448,2025-07-27T15:15:21.176877
Salim Yusuf,yusuf@mcmaster.ca,journal_articles,Resting heart rate is associated with renal disease outcomes in patients with vascular disease: results of theONTARGETandTRANSCENDstudies,Journal of Internal Medicine,2015,10.1111/joim.12333,https://experts.mcmaster.ca/display/publication543220,2025-07-27T15:15:21.176878
Salim Yusuf,yusuf@mcmaster.ca,journal_articles,Spreading the success of cardiovascular medicine worldwide.,European Heart Journal,2015,,https://experts.mcmaster.ca/display/publication1389656,2025-07-27T15:15:21.176879
Salim Yusuf,yusuf@mcmaster.ca,journal_articles,The World Heart Federation's vision for worldwide cardiovascular disease prevention,The Lancet,2015,10.1016/s0140-6736(15)60265-3,https://experts.mcmaster.ca/display/publication910450,2025-07-27T15:15:21.176880
Salim Yusuf,yusuf@mcmaster.ca,journal_articles,Contribution of common non-synonymous variants in PCSK1 to body mass index variation and risk of obesity: a systematic review and meta-analysis with evidence from up to 331 175 individuals,Human Molecular Genetics,2015,10.1093/hmg/ddv097,https://experts.mcmaster.ca/display/publication209061,2025-07-27T15:15:21.176882
Salim Yusuf,yusuf@mcmaster.ca,journal_articles,Mendelian randomization analysis supports the causal role of dysglycaemia and diabetes in the risk of coronary artery disease,European Heart Journal,2015,10.1093/eurheartj/ehv083,https://experts.mcmaster.ca/display/publication200922,2025-07-27T15:15:21.176883
Salim Yusuf,yusuf@mcmaster.ca,journal_articles,Healthy eating and reduced risk of cognitive decline,Neurology,2015,10.1212/wnl.0000000000001638,https://experts.mcmaster.ca/display/publication180112,2025-07-27T15:15:21.176884
Salim Yusuf,yusuf@mcmaster.ca,journal_articles,"Adapting the World Heart Federation Roadmaps at the National Level: Next
                        Steps and Conclusions",Global Heart,2015,10.1016/j.gheart.2015.04.004,https://experts.mcmaster.ca/display/publication910440,2025-07-27T15:15:21.176885
Salim Yusuf,yusuf@mcmaster.ca,journal_articles,Changes in Renal Function in Patients With Atrial Fibrillation,Journal of the American College of Cardiology,2015,10.1016/j.jacc.2015.03.577,https://experts.mcmaster.ca/display/publication871212,2025-07-27T15:15:21.176886
Salim Yusuf,yusuf@mcmaster.ca,journal_articles,Dietary Sodium and Cardiovascular Disease,Current Hypertension Reports,2015,10.1007/s11906-015-0559-8,https://experts.mcmaster.ca/display/publication179877,2025-07-27T15:15:21.176887
Salim Yusuf,yusuf@mcmaster.ca,journal_articles,"Reducing Cardiovascular Disease Globally: The World Heart Federation’s
                        Roadmaps",Global Heart,2015,10.1016/j.gheart.2015.05.001,https://experts.mcmaster.ca/display/publication910443,2025-07-27T15:15:21.176888
Salim Yusuf,yusuf@mcmaster.ca,journal_articles,"Reducing Premature Cardiovascular Morbidity and Mortality in People With
                        Atherosclerotic Vascular Disease: The World Heart Federation Roadmap for
                        Secondary Prevention of Cardiovascular Disease",Global Heart,2015,10.1016/j.gheart.2015.04.003,https://experts.mcmaster.ca/display/publication910441,2025-07-27T15:15:21.176889
Salim Yusuf,yusuf@mcmaster.ca,journal_articles,"Reducing Premature Cardiovascular Mortality By 2025: The World Heart
                        Federation Roadmap",Global Heart,2015,10.1016/j.gheart.2015.04.002,https://experts.mcmaster.ca/display/publication910442,2025-07-27T15:15:21.176890
Salim Yusuf,yusuf@mcmaster.ca,journal_articles,"Characteristics, complications, and gaps in evidence-based interventions in rheumatic heart disease: the Global Rheumatic Heart Disease Registry (the REMEDY study)",European Heart Journal,2015,10.1093/eurheartj/ehu449,https://experts.mcmaster.ca/display/publication543233,2025-07-27T15:15:21.176891
Salim Yusuf,yusuf@mcmaster.ca,journal_articles,"Anemia predicts thromboembolic events, bleeding complications and mortality in patients with atrial fibrillation: insights from the RE‐LY trial",Journal of Thrombosis and Haemostasis,2015,10.1111/jth.12874,https://experts.mcmaster.ca/display/publication593694,2025-07-27T15:15:21.176892
Salim Yusuf,yusuf@mcmaster.ca,journal_articles,Regular Wine Consumption in Chronic Heart Failure,Circulation. Heart Failure,2015,10.1161/circheartfailure.114.002091,https://experts.mcmaster.ca/display/publication1748363,2025-07-27T15:15:21.176893
Salim Yusuf,yusuf@mcmaster.ca,journal_articles,Randomized Trial of Primary PCI with or without Routine Manual Thrombectomy,New England Journal of Medicine,2015,10.1056/nejmoa1415098,https://experts.mcmaster.ca/display/publication456263,2025-07-27T15:15:21.176894
Salim Yusuf,yusuf@mcmaster.ca,journal_articles,Efficacy and safety of LDL-lowering therapy among men and women: meta-analysis of individual data from 174 000 participants in 27 randomised trials,The Lancet,2015,10.1016/s0140-6736(14)61368-4,https://experts.mcmaster.ca/display/publication443580,2025-07-27T15:15:21.176895
Salim Yusuf,yusuf@mcmaster.ca,journal_articles,"Elevated cholesteryl ester transfer protein (CETP) activity, a major determinant of the atherogenic dyslipidemia, and atherosclerotic cardiovascular disease in South Asians",European Journal of Preventive Cardiology (EJPC),2015,10.1177/2047487314528461,https://experts.mcmaster.ca/display/publication210273,2025-07-27T15:15:21.176896
Salim Yusuf,yusuf@mcmaster.ca,journal_articles,"Global Cardiovascular Research Training for Implementation Science, Health Systems Research, and Health Policy Research",Journal of the American College of Cardiology,2015,10.1016/j.jacc.2015.02.023,https://experts.mcmaster.ca/display/publication910454,2025-07-27T15:15:21.176898
Salim Yusuf,yusuf@mcmaster.ca,journal_articles,Modifiable lifestyle and social factors affect chronic kidney disease in high-risk individuals with type 2 diabetes mellitus,Kidney International,2015,10.1038/ki.2014.370,https://experts.mcmaster.ca/display/publication910466,2025-07-27T15:15:21.176898
Salim Yusuf,yusuf@mcmaster.ca,journal_articles,"Response to ‘Estimation of sodium excretion should be made as simple as possible, but not simpler",Journal of Hypertension,2015,10.1097/hjh.0000000000000549,https://experts.mcmaster.ca/display/publication179878,2025-07-27T15:15:21.176899
Salim Yusuf,yusuf@mcmaster.ca,journal_articles,Sodium Intake and Cardiovascular Health,Circulation Research,2015,10.1161/circresaha.116.303771,https://experts.mcmaster.ca/display/publication179881,2025-07-27T15:15:21.176900
Salim Yusuf,yusuf@mcmaster.ca,journal_articles,Effects of blood pressure lowering on cardiovascular risk according to baseline body-mass index: a meta-analysis of randomised trials,The Lancet,2015,10.1016/s0140-6736(14)61171-5,https://experts.mcmaster.ca/display/publication543247,2025-07-27T15:15:21.176901
Salim Yusuf,yusuf@mcmaster.ca,journal_articles,Influence of Tea Consumption on Acute Myocardial Infarction in China Population,Angiology,2015,10.1177/0003319714531849,https://experts.mcmaster.ca/display/publication543253,2025-07-27T15:15:21.176903
Salim Yusuf,yusuf@mcmaster.ca,journal_articles,Prognostic importance of temporal changes in resting heart rate in heart failure patients: an analysis of the CHARM program,European Heart Journal,2015,10.1093/eurheartj/ehu401,https://experts.mcmaster.ca/display/publication910474,2025-07-27T15:15:21.176903
Salim Yusuf,yusuf@mcmaster.ca,journal_articles,"Relationship Between Degree of Left Ventricular Dysfunction, Symptom Status, and Risk of Embolic Events in Patients With Atrial Fibrillation and Heart Failure",Stroke,2015,10.1161/strokeaha.114.007140,https://experts.mcmaster.ca/display/publication651893,2025-07-27T15:15:21.176905
Salim Yusuf,yusuf@mcmaster.ca,journal_articles,Systolic Blood Pressure Variation and Mean Heart Rate Is Associated With Cognitive Dysfunction in Patients With High Cardiovascular Risk,Hypertension,2015,10.1161/hypertensionaha.114.04568,https://experts.mcmaster.ca/display/publication179884,2025-07-27T15:15:21.176906
Salim Yusuf,yusuf@mcmaster.ca,journal_articles,Clinical characteristics and outcomes of patients with angina and heart failure in theCHARM(Candesartan in Heart Failure Assessment of Reduction in Mortality and Morbidity) Programme,EUROPEAN JOURNAL OF HEART FAILURE,2015,10.1002/ejhf.221,https://experts.mcmaster.ca/display/publication910460,2025-07-27T15:15:21.176907
Salim Yusuf,yusuf@mcmaster.ca,journal_articles,"Early cerebral small vessel disease and brain volume, cognition, and gait",Annals of Neurology,2015,10.1002/ana.24320,https://experts.mcmaster.ca/display/publication180114,2025-07-27T15:15:21.176908
Salim Yusuf,yusuf@mcmaster.ca,journal_articles,The burden of disease in older people and implications for health policy and practice,The Lancet,2015,10.1016/s0140-6736(14)61347-7,https://experts.mcmaster.ca/display/publication180120,2025-07-27T15:15:21.176909
Salim Yusuf,yusuf@mcmaster.ca,journal_articles,Cardiovascular Risk and Events and Country Income Stratum,New England Journal of Medicine,2015,10.1056/nejmc1412846,https://experts.mcmaster.ca/display/publication910462,2025-07-27T15:15:21.176910
Salim Yusuf,yusuf@mcmaster.ca,journal_articles,International Geographic Variation in Event Rates in Trials of Heart Failure With Preserved and Reduced Ejection Fraction,Circulation,2015,10.1161/circulationaha.114.012284,https://experts.mcmaster.ca/display/publication910468,2025-07-27T15:15:21.176911
Salim Yusuf,yusuf@mcmaster.ca,journal_articles,"Patients’ Knowledge, Attitudes, Behaviour and Health Care Experiences on the Prevention, Detection, Management and Control of Hypertension in Colombia: A Qualitative Study",PLoS ONE,2015,10.1371/journal.pone.0122112,https://experts.mcmaster.ca/display/publication459684,2025-07-27T15:15:21.176912
Salim Yusuf,yusuf@mcmaster.ca,journal_articles,Systolic and Diastolic Blood Pressure Changes in Relation With Myocardial Infarction and Stroke in Patients With Coronary Artery Disease,Hypertension,2015,10.1161/hypertensionaha.114.04310,https://experts.mcmaster.ca/display/publication543241,2025-07-27T15:15:21.176913
Salim Yusuf,yusuf@mcmaster.ca,journal_articles,Perioperative Aspirin and Clonidine and Risk of Acute Kidney Injury,Journal of the American Medical Association (JAMA),2014,10.1001/jama.2014.15284,https://experts.mcmaster.ca/display/publication551053,2025-07-27T15:15:21.176914
Salim Yusuf,yusuf@mcmaster.ca,journal_articles,Reply to both letters,Journal of Hypertension,2014,10.1097/hjh.0000000000000406,https://experts.mcmaster.ca/display/publication179883,2025-07-27T15:15:21.176915
Salim Yusuf,yusuf@mcmaster.ca,journal_articles,"Sleep duration, snoring habits and risk of acute myocardial infarction in China population: results of the INTERHEART study",BMC International Health and Human Rights,2014,10.1186/1471-2458-14-531,https://experts.mcmaster.ca/display/publication543272,2025-07-27T15:15:21.176916
Salim Yusuf,yusuf@mcmaster.ca,journal_articles,The relationship between estimated sodium and potassium excretion and subsequent renal outcomes,Kidney International,2014,10.1038/ki.2014.214,https://experts.mcmaster.ca/display/publication180224,2025-07-27T15:15:21.176917
Salim Yusuf,yusuf@mcmaster.ca,journal_articles,Sodium and Cardiovascular Disease,New England Journal of Medicine,2014,10.1056/nejmc1412113,https://experts.mcmaster.ca/display/publication179885,2025-07-27T15:15:21.176918
Salim Yusuf,yusuf@mcmaster.ca,journal_articles,Sodium and cardiovascular disease.,New England Journal of Medicine,2014,10.1056/NEJMc1412113,https://experts.mcmaster.ca/display/publication558181,2025-07-27T15:15:21.176919
Salim Yusuf,yusuf@mcmaster.ca,journal_articles,"Response to Letter Regarding Article, “Efficacy and Safety of Dabigatran Compared With Warfarin in Relation to Baseline Renal Function in Patients With Atrial Fibrillation: A RE-LY (Randomized Evaluation of Long-Term Anticoagulation Therapy) Trial Analysis”",Circulation,2014,10.1161/circulationaha.114.012350,https://experts.mcmaster.ca/display/publication871227,2025-07-27T15:15:21.176920
Salim Yusuf,yusuf@mcmaster.ca,journal_articles,Influence of Hospitalization for Cardiovascular Versus Noncardiovascular Reasons on Subsequent Mortality in Patients With Chronic Heart Failure Across the Spectrum of Ejection Fraction,Circulation. Heart Failure,2014,10.1161/circheartfailure.114.001567,https://experts.mcmaster.ca/display/publication910477,2025-07-27T15:15:21.176921
Salim Yusuf,yusuf@mcmaster.ca,journal_articles,Rationale and design of a randomized controlled trial evaluating community health worker–based interventions for the secondary prevention of acute coronary syndromes in India (SPREAD),American Heart Journal,2014,10.1016/j.ahj.2014.07.029,https://experts.mcmaster.ca/display/publication587692,2025-07-27T15:15:21.176922
Salim Yusuf,yusuf@mcmaster.ca,journal_articles,The Cost Implications of Off-Pump Versus On-Pump Coronary Artery Bypass Graft Surgery at One Year,Annals of Thoracic Surgery,2014,10.1016/j.athoracsur.2014.06.046,https://experts.mcmaster.ca/display/publication457381,2025-07-27T15:15:21.176924
Salim Yusuf,yusuf@mcmaster.ca,journal_articles,Additional Events in the RE-LY Trial,New England Journal of Medicine,2014,10.1056/nejmc1407908,https://experts.mcmaster.ca/display/publication871231,2025-07-27T15:15:21.176925
Salim Yusuf,yusuf@mcmaster.ca,journal_articles,Differences in Ischemic and Hemorrhagic Recurrence Rates among Race-Ethnic Groups in the PRoFESS Secondary Stroke Prevention Trial,International Journal of Stroke,2014,10.1111/ijs.12269,https://experts.mcmaster.ca/display/publication1748366,2025-07-27T15:15:21.176926
Salim Yusuf,yusuf@mcmaster.ca,journal_articles,Evidence Relating Sodium Intake to Blood Pressure and CVD,Current Cardiology Reports,2014,10.1007/s11886-014-0529-9,https://experts.mcmaster.ca/display/publication179896,2025-07-27T15:15:21.176927
Salim Yusuf,yusuf@mcmaster.ca,journal_articles,"Mortality and morbidity in relation to changes in albuminuria, glucose status and systolic blood pressure: an analysis of the ONTARGET and TRANSCEND studies",Diabetologia,2014,10.1007/s00125-014-3330-9,https://experts.mcmaster.ca/display/publication543263,2025-07-27T15:15:21.176928
Salim Yusuf,yusuf@mcmaster.ca,journal_articles,Multidetector CT assessment of partial anomalous pulmonary venous return in association with sinus venosus type atrial septal defect.,Quantitative Imaging in Medicine and Surgery,2014,10.3978/j.issn.2223-4292.2014.07.08,https://experts.mcmaster.ca/display/publication910471,2025-07-27T15:15:21.176929
Salim Yusuf,yusuf@mcmaster.ca,journal_articles,Sodium Intake and Renal Outcomes: A Systematic Review,American Journal of Hypertension,2014,10.1093/ajh/hpt294,https://experts.mcmaster.ca/display/publication180128,2025-07-27T15:15:21.176930
Salim Yusuf,yusuf@mcmaster.ca,journal_articles,Prednisolone andMycobacterium indicus praniiin Tuberculous Pericarditis,New England Journal of Medicine,2014,10.1056/nejmoa1407380,https://experts.mcmaster.ca/display/publication128070,2025-07-27T15:15:21.176931
Salim Yusuf,yusuf@mcmaster.ca,journal_articles,Predictors of early and late stroke following cardiac surgery,CANADIAN MEDICAL ASSOCIATION JOURNAL,2014,10.1503/cmaj.131214,https://experts.mcmaster.ca/display/publication651900,2025-07-27T15:15:21.176932
Salim Yusuf,yusuf@mcmaster.ca,journal_articles,"Response to Letter Regarding Article, “Management and Outcomes of Major Bleeding During Treatment With Dabigatran or Warfarin”",Circulation,2014,10.1161/circulationaha.114.010280,https://experts.mcmaster.ca/display/publication710998,2025-07-27T15:15:21.176933
Salim Yusuf,yusuf@mcmaster.ca,journal_articles,Association of cyclooxygenase-2 genetic variant with cardiovascular disease,European Heart Journal,2014,10.1093/eurheartj/ehu168,https://experts.mcmaster.ca/display/publication200941,2025-07-27T15:15:21.176934
Salim Yusuf,yusuf@mcmaster.ca,journal_articles,"Impact of lifestyle factors on fracture risk in older patients with cardiovascular disease: a prospective cohort study of 26,335 individuals from 40 countries",Age and Ageing,2014,10.1093/ageing/afu009,https://experts.mcmaster.ca/display/publication543276,2025-07-27T15:15:21.176935
Salim Yusuf,yusuf@mcmaster.ca,journal_articles,"Impact of rosiglitazone on body composition, hepatic fat, fatty acids, adipokines and glucose in persons with impaired fasting glucose or impaired glucose tolerance: a sub‐study of theDREAMtrial",Diabetic Medicine,2014,10.1111/dme.12512,https://experts.mcmaster.ca/display/publication201171,2025-07-27T15:15:21.176936
Salim Yusuf,yusuf@mcmaster.ca,journal_articles,"Cardiovascular Risk and Events in 17 Low-, Middle-, and High-Income Countries",New England Journal of Medicine,2014,10.1056/nejmoa1311890,https://experts.mcmaster.ca/display/publication192616,2025-07-27T15:15:21.176937
Salim Yusuf,yusuf@mcmaster.ca,journal_articles,"Response to Letter Regarding Article, “Causes of Death and Influencing Factors in Patients With Atrial Fibrillation: A Competing-Risk Analysis From the Randomized Evaluation of Long-Term Anticoagulant Therapy Study”",Circulation,2014,10.1161/circulationaha.114.010275,https://experts.mcmaster.ca/display/publication593722,2025-07-27T15:15:21.176938
Salim Yusuf,yusuf@mcmaster.ca,journal_articles,Association of Urinary Sodium and Potassium Excretion with Blood Pressure,New England Journal of Medicine,2014,10.1056/nejmoa1311989,https://experts.mcmaster.ca/display/publication180518,2025-07-27T15:15:21.176939
Salim Yusuf,yusuf@mcmaster.ca,journal_articles,"Urinary Sodium and Potassium Excretion, Mortality, and Cardiovascular Events",New England Journal of Medicine,2014,10.1056/nejmoa1311889,https://experts.mcmaster.ca/display/publication180516,2025-07-27T15:15:21.176940
Salim Yusuf,yusuf@mcmaster.ca,journal_articles,Blood pressure-lowering treatment based on cardiovascular risk: a meta-analysis of individual patient data,The Lancet,2014,10.1016/s0140-6736(14)61212-5,https://experts.mcmaster.ca/display/publication1724002,2025-07-27T15:15:21.176941
Salim Yusuf,yusuf@mcmaster.ca,journal_articles,Importance of persistent elevation of cardiac biomarkers in atrial fibrillation: a RE-LY substudy,Heart,2014,10.1136/heartjnl-2013-304872,https://experts.mcmaster.ca/display/publication871236,2025-07-27T15:15:21.176942
Salim Yusuf,yusuf@mcmaster.ca,journal_articles,"The Mini‐Mental State Examination, Clinical Factors, and Motor Vehicle Crash Risk",Journal of The American Geriatrics Society,2014,10.1111/jgs.12936,https://experts.mcmaster.ca/display/publication179887,2025-07-27T15:15:21.176943
Salim Yusuf,yusuf@mcmaster.ca,journal_articles,Patterns of Alcohol Consumption and Myocardial Infarction Risk,Circulation,2014,10.1161/circulationaha.113.007627,https://experts.mcmaster.ca/display/publication210271,2025-07-27T15:15:21.176944
Salim Yusuf,yusuf@mcmaster.ca,journal_articles,Efficacy and safety of apixaban compared with aspirin in patients who previously tried but failed treatment with vitamin K antagonists: results from the AVERROES trial,European Heart Journal,2014,10.1093/eurheartj/ehu048,https://experts.mcmaster.ca/display/publication871238,2025-07-27T15:15:21.176945
Salim Yusuf,yusuf@mcmaster.ca,journal_articles,Aliskiren alone or with other antihypertensives in the elderly with borderline and stage 1 hypertension: the APOLLO trial,European Heart Journal,2014,10.1093/eurheartj/ehu079,https://experts.mcmaster.ca/display/publication179888,2025-07-27T15:15:21.176946
Salim Yusuf,yusuf@mcmaster.ca,journal_articles,Basal insulin glargine and microvascular outcomes in dysglycaemic individuals: results of the Outcome Reduction with an Initial Glargine Intervention (ORIGIN) trial,Diabetologia,2014,10.1007/s00125-014-3238-4,https://experts.mcmaster.ca/display/publication886266,2025-07-27T15:15:21.176947
Salim Yusuf,yusuf@mcmaster.ca,journal_articles,Cost implications of the use of basal insulin glargine in people with early dysglycemia: The ORIGIN trial,Journal of Diabetes and its Complications,2014,10.1016/j.jdiacomp.2014.02.012,https://experts.mcmaster.ca/display/publication457389,2025-07-27T15:15:21.176948
Salim Yusuf,yusuf@mcmaster.ca,journal_articles,Effects of basal insulin glargine and omega-3 fatty acid on cognitive decline and probable cognitive impairment in people with dysglycaemia: a substudy of the ORIGIN trial,The Lancet Diabetes and Endocrinology,2014,10.1016/s2213-8587(14)70062-2,https://experts.mcmaster.ca/display/publication886265,2025-07-27T15:15:21.176949
Salim Yusuf,yusuf@mcmaster.ca,journal_articles,Incidental Magnetic Resonance Diffusion-Weighted Imaging–Positive Lesions Are Rare in Neurologically Asymptomatic Community-Dwelling Adults,Stroke,2014,10.1161/strokeaha.114.005782,https://experts.mcmaster.ca/display/publication180222,2025-07-27T15:15:21.176950
Salim Yusuf,yusuf@mcmaster.ca,journal_articles,Influence of Previous Heart Failure Hospitalization on Cardiovascular Events in Patients With Reduced and Preserved Ejection Fraction,Circulation. Heart Failure,2014,10.1161/circheartfailure.113.001281,https://experts.mcmaster.ca/display/publication910487,2025-07-27T15:15:21.176951
Salim Yusuf,yusuf@mcmaster.ca,journal_articles,Modification of Outcomes With Aspirin or Apixaban in Relation to Female and Male Sex in Patients With Atrial Fibrillation,Stroke,2014,10.1161/strokeaha.114.005746,https://experts.mcmaster.ca/display/publication593712,2025-07-27T15:15:21.176952
Salim Yusuf,yusuf@mcmaster.ca,journal_articles,Reply,Journal of the American College of Cardiology,2014,10.1016/j.jacc.2014.04.012,https://experts.mcmaster.ca/display/publication1365831,2025-07-27T15:15:21.176953
Salim Yusuf,yusuf@mcmaster.ca,journal_articles,Reply: regarding the effect of dabigatran plasma concentrations.,Journal of the American College of Cardiology,2014,10.1016/j.jacc.2014.04.012,https://experts.mcmaster.ca/display/publication871235,2025-07-27T15:15:21.176954
Salim Yusuf,yusuf@mcmaster.ca,journal_articles,Kidney Function After Off-Pump or On-Pump Coronary Artery Bypass Graft Surgery,Journal of the American Medical Association (JAMA),2014,10.1001/jama.2014.4952,https://experts.mcmaster.ca/display/publication457403,2025-07-27T15:15:21.176955
Salim Yusuf,yusuf@mcmaster.ca,journal_articles,Association of handgrip strength to cardiovascular mortality in pre-diabetic and diabetic patients: A subanalysis of the ORIGIN trial,International Journal of Cardiology,2014,10.1016/j.ijcard.2014.04.013,https://experts.mcmaster.ca/display/publication886267,2025-07-27T15:15:21.176956
Salim Yusuf,yusuf@mcmaster.ca,journal_articles,Impact of telmisartan on cardiovascular outcome in hypertensive patients at high risk,Journal of Hypertension,2014,10.1097/hjh.0000000000000154,https://experts.mcmaster.ca/display/publication543274,2025-07-27T15:15:21.176957
Salim Yusuf,yusuf@mcmaster.ca,journal_articles,Rationale and design of the PeriOperative ISchemic Evaluation-2 (POISE-2) trial: An international 2 × 2 factorial randomized controlled trial of acetyl-salicylic acid vs placebo and clonidine vs placebo in patients undergoing noncardiac surgery,American Heart Journal,2014,10.1016/j.ahj.2014.01.007,https://experts.mcmaster.ca/display/publication341522,2025-07-27T15:15:21.176958
Salim Yusuf,yusuf@mcmaster.ca,journal_articles,The cost implications of an early versus delayed invasive strategy in acute coronary syndromes: the TIMACS study,Journal of Medical Economics,2014,10.3111/13696998.2014.911184,https://experts.mcmaster.ca/display/publication910489,2025-07-27T15:15:21.176960
Salim Yusuf,yusuf@mcmaster.ca,journal_articles,"Corrigendum to ‘Analysing recurrent hospitalizations in heart failure: a review of statistical methodology, with application to CHARM‐Preserved’ [Eur J Heart Fail2014;16:33–40]",EUROPEAN JOURNAL OF HEART FAILURE,2014,10.1002/ejhf.86,https://experts.mcmaster.ca/display/publication1389698,2025-07-27T15:15:21.176960
Salim Yusuf,yusuf@mcmaster.ca,journal_articles,Incremental Value of Left Ventricular Systolic and Diastolic Function to Determine Outcome in Patients with Acute ST‐Segment Elevation Myocardial Infarction: The Echocardiographic Substudy of the OASIS‐6 Trial,Echocardiography,2014,10.1111/echo.12452,https://experts.mcmaster.ca/display/publication910232,2025-07-27T15:15:21.176961
Salim Yusuf,yusuf@mcmaster.ca,journal_articles,Rationale and design of the Steroids in Cardiac Surgery trial,American Heart Journal,2014,10.1016/j.ahj.2014.01.018,https://experts.mcmaster.ca/display/publication457391,2025-07-27T15:15:21.176962
Salim Yusuf,yusuf@mcmaster.ca,journal_articles,The Association of Basal Insulin Glargine and/or n-3 Fatty Acids With Incident Cancers in Patients With Dysglycemia,Diabetes Care,2014,10.2337/dc13-1468,https://experts.mcmaster.ca/display/publication886271,2025-07-27T15:15:21.176963
Salim Yusuf,yusuf@mcmaster.ca,journal_articles,The Population Risks of Dietary Salt Excess Are Exaggerated,Canadian Journal of Cardiology,2014,10.1016/j.cjca.2014.02.003,https://experts.mcmaster.ca/display/publication179890,2025-07-27T15:15:21.176964
Salim Yusuf,yusuf@mcmaster.ca,journal_articles,Towards better hypertension management in India.,Indian Journal of Medical Research,2014,,https://experts.mcmaster.ca/display/publication910482,2025-07-27T15:15:21.176965
